The third line of each test case contains q integers x1,x2,x3,\xe2\x80\xa6,xq \xe2\x80\x94 the elements of the array x (1\xe2\x89\xa4xi\xe2\x89\xa430), which are the modification queries.
It is guaranteed that the sum of n and the sum of q across all test cases does not exceed 2\xe2\x8b\x85105.
For each test case, output the array after all of the modification queries.
In the first test case, the first query will add 2 to the integers in positions 4 and 5. After this addition, the array would be [1,2,3,6,6]. Other operations will not modify the array.
In the second test case, the first modification query does not change the array. The second modification query will add 8 to the integer in position 5, so that the array would look like this: [7,8,12,36,56,6,3]. The third modification query will add 2 to the integers in positions 2,3, 4 and 5. The array would then look like this: [7,10,14,38,58,6,3]." "1100  x18407"
1891A "Sorting with Twos" "constructive algorithms, sortings" "You are given an array of integers a1,a2,\xe2\x80\xa6,an. In one operation, you do the following: 
Can you sort the array in non-decreasing order by performing some number (possibly zero) of operations?
An array is considered non-decreasing if ai\xe2\x89\xa4ai+1 for all integers i such that 1\xe2\x89\xa4i\xe2\x89\xa4n\xe2\x88\x921.
The first line contains a single integer t (1\xe2\x89\xa4t\xe2\x89\xa4104) \xe2\x80\x94 the number of test cases. The description of the test cases follows.
The first line of each test case contains a single integer n (1\xe2\x89\xa4n\xe2\x89\xa420) \xe2\x80\x94 the length of array a.
The second line of each test case contains n integers a1,a2,\xe2\x80\xa6,an \xe2\x80\x94 the integers in array a (0\xe2\x89\xa4ai\xe2\x89\xa41000).
For each test case, output ""YES"" if the array can be sorted, and ""NO"" otherwise.
In the first test case, the array is already sorted in non-decreasing order, so we don\'t have to perform any operations.
In the second test case, we can choose m=1 twice to get the array [4,3,3,4,4]. Then, we can choose m=0 once and get the sorted in non-decreasing order array [3,3,3,4,4].
In the third test case, we can choose m=0 once and get the array [5,5,5,7,5,6,6,8,7]. Then, we can choose m=2 twice and get the array [3,3,3,5,5,6,6,8,7]. After that, we can choose m=3 once and get the sorted in non-decreasing order array [2,2,2,4,4,5,5,7,7].
For the fourth and fifth test case, it can be shown that the array could not be sorted using these operations." "800  x19332"
1890B "Qingshan Loves Strings" "constructive algorithms, implementation" "Qingshan has a string s, while Daniel has a string t. Both strings only contain 0 and 1.
A string a of length k is good if and only if
For example, 1, 101, 0101 are good, while 11, 1001, 001100 are not good.
Qingshan wants to make s good. To do this, she can do the following operation any number of times (possibly, zero):
Please tell Qingshan if it is possible to make s good.
The input consists of multiple test cases. The first line contains a single integer T (1\xe2\x89\xa4T\xe2\x89\xa42000) \xe2\x80\x94 the number of test cases. The description of the test cases follows.
The first line of each test case contains two integers n and m (1\xe2\x89\xa4n,m\xe2\x89\xa450) \xe2\x80\x94 the length of the strings s and t, respectively.
The second line of each test case contains a string s of length n.
The third line of each test case contains a string t of length m.
It is guaranteed that s and t only contain 0 and 1.
For each test case, print ""YES"" (without quotes), if it is possible to make s good, and ""NO"" (without quotes) otherwise.
You can print letters in any case (upper or lower).
In the first test case, s is good initially, so you can get a good s by doing zero operations.
In the second test case, you can do the following two operations (the inserted string t is underlined):
and get s=101010101, which is good.
In the third test case, there is no way to make s good after any number of operations." "800  x17608"
1890A "Doremy's Paint 3" "constructive algorithms" "An array b1,b2,\xe2\x80\xa6,bn of positive integers is good if all the sums of two adjacent elements are equal to the same value. More formally, the array is good if there exists a k such that b1+b2=b2+b3=\xe2\x80\xa6=bn\xe2\x88\x921+bn=k.
Doremy has an array a of length n. Now Doremy can permute its elements (change their order) however she wants. Determine if she can make the array good.
The input consists of multiple test cases. The first line contains a single integer t (1\xe2\x89\xa4t\xe2\x89\xa4100) \xe2\x80\x94 the number of test cases. The description of the test cases follows.
The first line of each test case contains a single integer n (2\xe2\x89\xa4n\xe2\x89\xa4100) \xe2\x80\x94 the length of the array a.
The second line of each test case contains n integers a1,a2,\xe2\x80\xa6,an (1\xe2\x89\xa4ai\xe2\x89\xa4105).
There are no constraints on the sum of n over all test cases.
For each test case, print ""Yes"" (without quotes), if it is possible to make the array good, and ""No"" (without quotes) otherwise.
You can output the answer in any case (upper or lower). For example, the strings ""yEs"", ""yes"", ""Yes"", and ""YES"" will be recognized as positive responses.
In the first test case, [8,9] and [9,8] are good.
In the second test case, [1,2,1] is good because a1+a2=a2+a3=3.
In the third test case, it can be shown that no permutation is good." "800  x27753"
1889F "Doremy's Average Tree" "data structures, dp, greedy, trees" "Doremy has a rooted tree of size nn whose root is vertex r. Initially there is a number wi written on vertex i. Doremy can use her power to perform this operation at most k times:
Doremy wants to know what is the lexicographically smallest\xe2\x80\xa0 array w after performing all the operations. Can you help her?
If there are multiple answers, you may output any one.
\xe2\x80\xa0 For arrays a and b both of length n, a is lexicographically smaller than b if and only if there exist an index i (1\xe2\x89\xa4i\xe2\x89\xa4n) such that ai<bi and for all indices j such that j<i, aj=bj is satisfied.
The input consists of multiple test cases. The first line contains a single integer t (1\xe2\x89\xa4t\xe2\x89\xa4104) \xe2\x80\x94 the number of test cases. The description of the test cases follows.
The first line contains three integers n, r, k (2\xe2\x89\xa4n\xe2\x89\xa45000, 1\xe2\x89\xa4r\xe2\x89\xa4n, 0\xe2\x89\xa4k\xe2\x89\xa4min(500,n)).
The second line contains n integers w1,w2,\xe2\x80\xa6,wn (1\xe2\x89\xa4wi\xe2\x89\xa4106).
Each of the next n\xe2\x88\x921 lines contains two integers ui, vi (1\xe2\x89\xa4ui,vi\xe2\x89\xa4n), representing an edge between ui and vi.
It is guaranteed that the given edges form a tree.
It is guaranteed that the sum of n does not exceed 50000.
For each test case, In the first line, output a single integer cnt (0\xe2\x89\xa4cnt\xe2\x89\xa4k) \xe2\x80\x94 the number of operations you perform.
Then, in the second line output cnt integers p1,p2,\xe2\x80\xa6,pcnt \xe2\x80\x94 x is chosen to be pi for i-th operation.
If there are multiple answers, you may output any one.
In the first test case:

At first w=[1,9,2,6,1,8]. You can choose some vertex x to perform at most one operation.
w is lexicographically smallest when x=2." "3500  x82"
1889E "Doremy's Swapping Trees" "dfs and similar, graphs, trees" "Consider two undirected graphs G1G1 and G2G2. Every node in G1G1 and in G2G2 has a label. Doremy calls G1G1 and G2 similar if and only if:
Now Doremy gives you two trees T1 and T2 with n nodes, labeled from 1 to n. You can do the following operation any number of times:
Now Doremy is wondering how many distinct T1 you can get after any number of operations. Can you help her find the answer? Output the answer modulo 109+7.
The input consists of multiple test cases. The first line contains a single integer t (1\xe2\x89\xa4t\xe2\x89\xa42\xe2\x8b\x85104) \xe2\x80\x94 the number of test cases. The description of the test cases follows.
The first line contains an integer n (2\xe2\x89\xa4n\xe2\x89\xa4105) \xe2\x80\x94 the number of nodes in the trees T1 and T2.
Each of the following n\xe2\x88\x921 lines contain two integers u,v (1\xe2\x89\xa4u,v\xe2\x89\xa4n), representing an undirected edge in T1. It is guaranteed these edges form a tree.
Each of the following n\xe2\x88\x921 lines contain two integers u,v (1\xe2\x89\xa4u,v\xe2\x89\xa4n), representing an undirected edge in T2. It is guaranteed these edges form a tree.
It is guaranteed that the sum of n does not exceed 2\xe2\x8b\x85105.
For each test case, you should output a single line with an integer, representing the number of distinct T1 after any number of operations, modulo 109+7.
In the first test case, there is at most one distinct T1 having the only edge (1,2).
In the second test case, you can choose the edge set {(1,3),(2,3)} in T1, the edge set {(1,2),(2,3)} in T2 and swap them. So T1 can be 1\xe2\x88\x923\xe2\x88\x922 or 1\xe2\x88\x922\xe2\x88\x923.
In the third test case, there are 4 distinct T1, as the following pictures.
" "3500  x112"
1889D "Game of Stacks" "brute force, dfs and similar, graphs, implementation, trees" "You have n stacks r1,r2,\xe2\x80\xa6,rn. Each stack contains some positive integers ranging from 1 to n.
Define the following functions:
You want to know the values returned by init(1),init(2),\xe2\x80\xa6,init(n).
Note that, during these calls, the stacks r1,r2,\xe2\x80\xa6,rn don\'t change, so the calls init(1),init(2),\xe2\x80\xa6,init(n) are independent.
The first line of the input contains one integer n (1\xe2\x89\xa4n\xe2\x89\xa4105) \xe2\x80\x94 the length of the array r.
Each of the following n lines contains several integers. The first integer ki (0\xe2\x89\xa4ki\xe2\x89\xa4105) represents the number of elements in the i-th stack, and the following ki positive integers ci,1,ci,2,\xe2\x80\xa6,ci,ki (1\xe2\x89\xa4ci,j\xe2\x89\xa4n) represent the elements in the i-th stack. ci,1 is the bottom element.
In each test, \xe2\x88\x91ki\xe2\x89\xa4106.
You need to output n values, the i-th of which is the value returned by init(i).
In the first example: " "3000  x621"
1889C2 "Doremy's Drying Plan (Hard Version)" "data structures, dp" "The only differences between the two versions of this problem are the constraint on kk, the time limit and the memory limit. You can make hacks only if all versions of the problem are solved.
Doremy lives in a rainy country consisting of n cities numbered from 1 to n.
The weather broadcast predicted the distribution of rain in the next m days. In the i-th day, it will rain in the cities in the interval [li,ri]. A city is called dry if it will never rain in that city in the next m days.
It turns out that Doremy has a special power. She can choose k days, and during these days it will not rain. Doremy wants to calculate the maximum number of dry cities after using the special power.
The input consists of multiple test cases. The first line contains a single integer t (1\xe2\x89\xa4t\xe2\x89\xa4104) \xe2\x80\x94 the number of test cases. The description of the test cases follows.
The first line contains three integers n, m and k (1\xe2\x89\xa4n\xe2\x89\xa42\xe2\x8b\x85105, 2\xe2\x89\xa4m\xe2\x89\xa42\xe2\x8b\x85105, 2\xe2\x89\xa4k\xe2\x89\xa4min(10,m)) \xe2\x80\x94 the number of cities, the number of days, and the number of days of rain that Doremy can prevent.
Then, m lines follow. The i-th line contains two integers li, ri (1\xe2\x89\xa4li\xe2\x89\xa4ri\xe2\x89\xa4n) \xe2\x80\x94 the rain coverage on day i.
It is guaranteed that the sum of n and the sum of m over all test cases do not exceed 2\xe2\x8b\x85105.
For each test case, output one integer \xe2\x80\x94 the maximum number of dry cities.
In the first test case, if Doremy prevents
So there is at most 1 dry city.
In the second test case, if Doremy prevents
So there are at most 2 dry cities.
In the third test case, it is optimal to prevent rain 1,2,4,5.
In the forth test case, there is always a day of rain that wets all the cities and cannot be prevented." "2600  x1011"
1889C1 "Doremy's Drying Plan (Easy Version)" "brute force, data structures, dp, greedy, sortings" "The only differences between the two versions of this problem are the constraint on kk, the time limit and the memory limit. You can make hacks only if all versions of the problem are solved.
Doremy lives in a rainy country consisting of n cities numbered from 1 to n.
The weather broadcast predicted the distribution of rain in the next m days. In the i-th day, it will rain in the cities in the interval [li,ri]. A city is called dry if it will never rain in that city in the next m days.
It turns out that Doremy has a special power. She can choose k days (in the easy version, k=2), and during these days it will not rain. Doremy wants to calculate the maximum number of dry cities after using the special power.
The input consists of multiple test cases. The first line contains a single integer t (1\xe2\x89\xa4t\xe2\x89\xa4104) \xe2\x80\x94 the number of test cases. The description of the test cases follows.
The first line contains three integers n, m and k (1\xe2\x89\xa4n\xe2\x89\xa42\xe2\x8b\x85105, 2\xe2\x89\xa4m\xe2\x89\xa42\xe2\x8b\x85105, k=2) \xe2\x80\x94 the number of cities, the number of days, and the number of days of rain that Doremy can prevent.
Then, m lines follow. The i-th line contains two integers li, ri (1\xe2\x89\xa4li\xe2\x89\xa4ri\xe2\x89\xa4n) \xe2\x80\x94 the rain coverage on day i.
It is guaranteed that the sum of n and the sum of m over all test cases do not exceed 2\xe2\x8b\x85105.
For each test case, output one integer \xe2\x80\x94 the maximum number of dry cities.
In the first test case, if Doremy prevents
So there is at most 1 dry city.
In the second test case, if Doremy prevents
So there are at most 2 dry cities.
In the third test case, it is optimal to prevent rain 2,5.
In the forth test case, there is always 4 days of rain that wets all the cities and cannot be prevented." "2000  x3326"
1889B "Doremy's Connecting Plan" "constructive algorithms, greedy, math, sortings" "Doremy lives in a country consisting of nn cities numbered from 1 to n, with ai people living in the i-th city. It can be modeled as an undirected graph with n nodes.
Initially, there are no edges in the graph. Now Doremy wants to make the graph connected. 
To do this, she can add an edge between i and j if 
\xe2\x88\x91k\xe2\x88\x88Sak\xe2\x89\xa5i\xe2\x8b\x85j\xe2\x8b\x85c,
where S is the set of all the nodes that are currently in the same connected component of either i or j, and c is a given constant.
Can Doremy make the graph connected?
Two nodes (i,j) are in the same connected component if there exists a path from i to j. A graph is connected if all its nodes are in the same connected component.
The input consists of multiple test cases. The first line contains a single integer t (1\xe2\x89\xa4t\xe2\x89\xa4104) \xe2\x80\x94 the number of test cases. The description of the test cases follows.
The first line contains two integers n, c (2\xe2\x89\xa4n\xe2\x89\xa42\xe2\x8b\x85105, 1\xe2\x89\xa4c\xe2\x89\xa4106) \xe2\x80\x94 the number of nodes and the constant.
The second line of each test case contains n integers a1,a2,\xe2\x80\xa6,an (0\xe2\x89\xa4ai\xe2\x89\xa41012) \xe2\x80\x94 the number of people living in the i-th city.
It is guaranteed that the sum of n over all test cases does not exceed 2\xe2\x8b\x85105.
For each test case, print ""YES"" (without quotes), if it is possible to make the graph connected, and ""NO"" (without quotes) otherwise.
You can print letters in any case (upper or lower).
In the first test case, Doremy can add edges in the following order:
In the second test case, Doremy can add edge (1,2) because a1+a2=2\xe2\x89\xa51\xe2\x8b\x852\xe2\x8b\x851. After that, the graph is connected.
In the third test case, Doremy can add edges in the order (5,4), (5,3), (5,2) and (5,1).
In the fourth test case, Doremy cannot add any edge at all." "1700  x7468"
1889A "Qingshan Loves Strings 2" "constructive algorithms, greedy, implementation" "Qingshan has a string ss which only contains 0 and 1.
A string a of length k is good if and only if
For Div. 2 contestants, note that this condition is different from the condition in problem B.
For example, 10, 1010, 111000 are good, while 11, 101, 001, 001100 are not good.
Qingshan wants to make s good. To do this, she can do the following operation at most 300 times (possibly, zero): 
Please tell Qingshan if it is possible to make s good. If it is possible, print a sequence of operations that makes s good.
The input consists of multiple test cases. The first line contains a single integer t (1\xe2\x89\xa4t\xe2\x89\xa4100) \xe2\x80\x94 the number of test cases. The description of the test cases follows.
The first line of each test case contains a single integer n (1\xe2\x89\xa4n\xe2\x89\xa4100) \xe2\x80\x94 the length of string s, respectively.
The second line of each test case contains a string s with length n.
It is guaranteed that s only consists of 0 and 1.
For each test case, if it impossible to make s good, output \xe2\x88\x921.
Otherwise, output p (0\xe2\x89\xa4p\xe2\x89\xa4300) \xe2\x80\x94 the number of operations, in the first line.
Then, output p integers in the second line. The i-th integer should be an index xi (0\xe2\x89\xa4xi\xe2\x89\xa4n+2i\xe2\x88\x922) \xe2\x80\x94 the position where you want to insert 01 in the current s. If xi=0, you insert 01 at the beginning of s. Otherwise, you insert 01 immediately after the xi-th character of s.
We can show that under the constraints in this problem, if an answer exists, there is always an answer that requires at most 300 operations.
In the first test case, you can do zero operations and get s=01, which is good.
Another valid solution is to do one operation: (the inserted 01 is underlined)
and get s=0011, which is good.
In the second and the third test case, it is impossible to make s good.
In the fourth test case, you can do two operations:
and get s=0011100011, which is good." "1300  x13347"
1887F "Minimum Segments" "constructive algorithms" "You had a sequence a1,a2,\xe2\x80\xa6,an consisting of integers from 1 to n, not necessarily distinct. For some unknown reason, you decided to calculate the following characteristic of the sequence: 
Each test consist of multiple test cases. The first line contains a single integer t (1\xe2\x89\xa4t\xe2\x89\xa4104) \xe2\x80\x94 the number of test cases. The description of test cases follows.
The first line of each test case contains a single integer n (1\xe2\x89\xa4n\xe2\x89\xa42\xe2\x8b\x85105) \xe2\x80\x94 the length of the lost sequence a.
The second line of each test case contains n integers r1,r2,\xe2\x80\xa6,rn (i\xe2\x89\xa4ri\xe2\x89\xa4n+1) \xe2\x80\x94 the characteristic of the lost sequence a. 
It is guaranteed that the sum of n over all test cases does not exceed 2\xe2\x8b\x85105.
For each test case, output the following: 
In the first test case, the sequence a=[1,2,1] is suitable. The integers 1 and 2 appear on the subsegments [1,2] and [2,3].
In the second test case, it can be proved that there is no suitable sequence a." "3400  x174"
1887E "Good Colorings" "binary search, constructive algorithms, graphs, interactive" "Alice suggested Bob to play a game. Bob didn\'t like this idea, but he couldn\'t refuse Alice, so he asked you to write a program that would play instead of him.
The game starts with Alice taking out a grid sheet of size n\xc3\x97n, the cells of which are initially not colored. After that she colors some 2n cells with colors 1,2,\xe2\x80\xa6,2n, respectively, and informs Bob about these cells.
In one move, Bob can point to a cell that has not been colored yet and ask Alice to color that cell. Alice colors that cell with one of the 2n colors of her choice, informing Bob of the chosen color. Bob can make no more than 10 moves, after which he needs to find a good set of four cells.
A set of four cells is considered good if the following conditions are met:
Each test consists of multiple test cases. The first line contains a single integer t (1\xe2\x89\xa4t\xe2\x89\xa4200) \xe2\x80\x94 the number of test cases. The description of the test cases follows.
The first line of each test case contains a single integer n (3\xe2\x89\xa4n\xe2\x89\xa41000) \xe2\x80\x94 the size of the grid.
The i-th of the following 2n lines contains two integers xi and yi (1\xe2\x89\xa4xi,yi\xe2\x89\xa4n) \xe2\x80\x94 the coordinates of the cell colored with the i-th color.
It is guaranteed that all coordinates (xi,yi) are pairwise distinct for the same test case.
After reading the input data for each test case, continue the interaction as described below.
You can make no more than 10 moves. To make a move, output ""? x y"" (1\xe2\x89\xa4x,y\xe2\x89\xa4n). In response to this, the jury\'s program will output a single integer from 1 to 2n \xe2\x80\x94 the color of cell (x,y).
After all moves (it is not necessary to make all 10 moves and it is not necessary to make at least one move), output a string in the format ""! x1 x2 y1 y2"" (1\xe2\x89\xa4x1,x2,y1,y2\xe2\x89\xa4n,x1\xe2\x89\xa0x2,y1\xe2\x89\xa0y2). If cells (x1,y1), (x1,y2), (x2,y1), (x2,y2) are colored with different colors, the jury\'s program will output ""OK"". After that, proceed to the next test case or terminate the program if there are no more test cases left.
Otherwise, if any of the specified cells are colored with the same color or one of the cells is not colored yet, the jury\'s program will output ""ERROR"". In this case, your program should immediately terminate its execution to receive the Wrong Answer verdict. Otherwise, you may receive an arbitrary verdict.
After each move or answer, do not forget to output the end of line and flush the output. Otherwise, you will get the Idleness limit exceeded verdict.
To do this, use:
Note that the interactor is adaptive, meaning that the color Alice will use to color the cells during Bob\'s moves is not fixed in advance.
Hacks
You cannot use hacks in this problem.
In the first test case:
In the second test case, cells with coordinates (1,1),(1,2),(2,1),(2,2) are initially colored by Alice in different colors." "3100  x384"
1887D Split "binary search, data structures, divide and conquer, dsu, math, trees, two pointers" "Let\'s call an array b1,b2,\xe2\x80\xa6,bm (m\xe2\x89\xa52) good if it can be split into two parts such that all elements in the left part are strictly smaller than all elements in the right part. In other words, there must exist an index 1\xe2\x89\xa4i<m such that every element from b1,\xe2\x80\xa6,bi is strictly smaller than every element from bi+1,\xe2\x80\xa6,bm.
Given an array a1,a2,\xe2\x80\xa6an consisting of distinct integers from 1 to n. There are q queries. Each query consists of two numbers l and r. For each query, determine whether the array al,al+1,\xe2\x80\xa6,ar is good.
The first line contains a single integer n (2\xe2\x89\xa4n\xe2\x89\xa43\xe2\x8b\x85105) \xe2\x80\x94 the size of the array.
The second line contains n distinct integers a1,a2,\xe2\x80\xa6,an (1\xe2\x89\xa4an\xe2\x89\xa4n) \xe2\x80\x94 the elements of the array a.
The third line contains a single integer q (1\xe2\x89\xa4q\xe2\x89\xa43\xe2\x8b\x85105) \xe2\x80\x94 the number of queries.
Each of the next q lines contains two integers li and ri (1\xe2\x89\xa4li<ri\xe2\x89\xa4n) \xe2\x80\x94 the description of the i-th query.
For each query, output ""Yes"" (without quotes) if the array al,al+1,\xe2\x80\xa6,ar is good, and ""No"" (without quotes) otherwise.
You can output ""Yes"" and ""No"" in any case (for example, the strings ""yEs"", ""yes"", ""Yes"", and ""YES"" will be recognized as a positive answer).
In the first example:
In the second example:" "2700  x979"
1887C "Minimum Array" "binary search, brute force, constructive algorithms, data structures, greedy, hashing, two pointers" "Given an array a of length n consisting of integers. Then the following operation is sequentially applied to it q times:
Let bj be the array a obtained after applying the first j operations (0\xe2\x89\xa4j\xe2\x89\xa4q). Note that b0 is the array a before applying any operations.
You need to find the lexicographically minimum\xe2\x80\xa0 array among all arrays bj.
\xe2\x80\xa0An array x is lexicographically smaller than array y if there is an index i such that xi<yi, and xj=yj for all j<i. In other words, for the first index i where the arrays differ, xi<yi.
Each test consists of multiple test cases. The first line contains a single integer t (1\xe2\x89\xa4t\xe2\x89\xa45\xe2\x8b\x85105) \xe2\x80\x94 the number of test cases. The description of the test cases follows.
The first line of each test case contains a single integer n (1\xe2\x89\xa4n\xe2\x89\xa45\xe2\x8b\x85105) \xe2\x80\x94 the length of array a.
The second line of each test case contains n integers a1,a2,\xe2\x80\xa6,an (\xe2\x88\x92109\xe2\x89\xa4ai\xe2\x89\xa4109) \xe2\x80\x94 the elements of array a.
The third line of each test case contains a single integer q (0\xe2\x89\xa4q\xe2\x89\xa45\xe2\x8b\x85105) \xe2\x80\x94 the number of operations on the array.
In each of the next q lines, there are three integers lj, rj, and xj (1\xe2\x89\xa4lj\xe2\x89\xa4rj\xe2\x89\xa4n,\xe2\x88\x92109\xe2\x89\xa4xj\xe2\x89\xa4109) \xe2\x80\x94 the description of each operation. The operations are given in the order they are applied.
It is guaranteed that the sum of n over all test cases and the sum of q over all test cases do not exceed 5\xe2\x8b\x85105.
For each test case, output the lexicographically minimum array among all arrays bj.
In the first test case:
Thus, the lexicographically minimum array is b2.
In the second test case, the lexicographically minimum array is b0." "2400  x1772"
