To do this, he can remove any pair of adjacent characters from s any number of times, provided they are different. For example, if s=racoon, then by removing one pair of characters he can obtain the strings coon, roon, raon, and raco, but he cannot obtain racn (because the removed letters were the same) or rcon (because the removed letters were not adjacent).
What is the minimum length Vlad can achieve by applying any number of deletions?
The first line of the input contains a single integer t (1\xe2\x89\xa4t\xe2\x89\xa4104) \xe2\x80\x94 the number of test cases. Descriptions of the test cases follow.
The first line of each test case contains a single integer n (1\xe2\x89\xa4n\xe2\x89\xa42\xe2\x8b\x85105) \xe2\x80\x94 the length of the string s.
The second line of each test case contains the string s consisting of n lowercase Latin letters.
It is guaranteed that the sum of n over all test cases does not exceed 2\xe2\x8b\x85105.
For each test case, output a single number\xe2\x80\x94the minimum length of the string s, after removing pairs of adjacent characters with different values.
In the first test case of the example, you need to act as follows: ""aabc"" \xe2\x86\x92 ""ac"" \xe2\x86\x92 """". Note that with a different order of deletions, the string will not become empty." "1200  x20404"
1907B YetnotherrokenKeoard "data structures, implementation, strings" "Polycarp has a problem \xe2\x80\x94 his laptop keyboard is broken.
Now, when he presses the \'b\' key, it acts like an unusual backspace: it deletes the last (rightmost) lowercase letter in the typed string. If there are no lowercase letters in the typed string, then the press is completely ignored.
Similarly, when he presses the \'B\' key, it deletes the last (rightmost) uppercase letter in the typed string. If there are no uppercase letters in the typed string, then the press is completely ignored.
In both cases, the letters \'b\' and \'B\' are not added to the typed string when these keys are pressed.
Consider an example where the sequence of key presses was ""ARaBbbitBaby"". In this case, the typed string will change as follows: """" A\xe2\x86\x92 ""A"" R\xe2\x86\x92 ""AR"" a\xe2\x86\x92 ""ARa"" B\xe2\x86\x92 ""Aa"" b\xe2\x86\x92 ""A"" b\xe2\x86\x92 ""A"" i\xe2\x86\x92 ""Ai"" t\xe2\x86\x92 ""Ait"" B\xe2\x86\x92 ""it"" a\xe2\x86\x92 ""ita"" b\xe2\x86\x92 ""it"" y\xe2\x86\x92 ""ity"".
Given a sequence of pressed keys, output the typed string after processing all key presses.
The first line of the input data contains an integer t (1\xe2\x89\xa4t\xe2\x89\xa41000), the number of test cases in the test.
The following contains t non-empty lines, which consist of lowercase and uppercase letters of the Latin alphabet.
It is guaranteed that each line contains at least one letter and the sum of the lengths of the lines does not exceed 106.
For each test case, output the result of processing the key presses on a separate line. If the typed string is empty, then output an empty line." "1000  x25971"
1907A Rook implementation "As you probably know, chess is a game that is played on a board with 64 squares arranged in an 8\xc3\x978 grid. Columns of this board are labeled with letters from a to h, and rows are labeled with digits from 1 to 8. Each square is described by the row and column it belongs to.
The rook is a piece in the game of chess. During its turn, it may move any non-zero number of squares horizontally or vertically. Your task is to find all possible moves for a rook on an empty chessboard.
The first line of input contains single integer t (1\xe2\x89\xa4t\xe2\x89\xa464) \xe2\x80\x94 the number of test cases. The descriptions of test cases follow.
Each test case contains one string of two characters, description of the square where rook is positioned. The first character is a letter from a to h, the label of column, and the second character is a digit from 1 to 8, the label of row. 
The same position may occur in more than one test case.
For each test case, output descriptions of all squares where the rook can move, in the same format as in the input. 
You can output squares in any order per test case." "800  x37053"
1894A "Secret Sport" "implementation, strings" "Let\'s consider a game in which two players, A and B, participate. This game is characterized by two positive integers, XX and Y.
The game consists of sets, and each set consists of plays. In each play, exactly one of the players, either A or B, wins. A set ends exactly when one of the players reaches X wins in the plays of that set. This player is declared the winner of the set. The players play sets until one of them reaches Y wins in the sets. After that, the game ends, and this player is declared the winner of the entire game.
You have just watched a game but didn\'t notice who was declared the winner. You remember that during the game, n plays were played, and you know which player won each play. However, you do not know the values of X and Y. Based on the available information, determine who won the entire game \xe2\x80\x94 A or B. If there is not enough information to determine the winner, you should also report it.
Each test contains multiple test cases. The first line contains a single integer t (1\xe2\x89\xa4t\xe2\x89\xa4104) - the number of test cases. The description of the test cases follows.
The first line of each test case contains an integer n (1\xe2\x89\xa4n\xe2\x89\xa420) - the number of plays played during the game.
The second line of each test case contains a string s of length n, consisting of characters A and B. If si=A, it means that player A won the i-th play. If si=B, it means that player B won the i-th play.
It is guaranteed that the given sequence of plays corresponds to at least one valid game scenario, for some values of X and Y.
For each test case, output:
In the first test case, the game could have been played with parameters X=3, Y=1. The game consisted of 1 set, in which player A won, as they won the first 3 plays. In this scenario, player A is the winner. The game could also have been played with parameters X=1, Y=3. It can be shown that there are no such X and Y values for which player B would be the winner.
In the second test case, player B won all the plays. It can be easily shown that in this case, player B is guaranteed to be the winner of the game.
In the fourth test case, the game could have been played with parameters X=3, Y=3:
In total, player B was the first player to win 3 sets. They are declared the winner of the game." "800  x19032"
1893E "Cacti Symphony" "combinatorics, dfs and similar, dp, graphs" "You are given an undirected connected graph in which any two distinct simple cycles do not have common vertices. Since the graph can be very large, it is given to you in a compressed form: for each edge, you are also given a number d, which indicates that there are d additional vertices on this edge.
You need to assign a weight to each vertex and each edge of the graph \xe2\x80\x94 an integer from 1 to 3.
An edge of the graph is called good if the bitwise XOR of the weights of its adjacent vertices is not equal to 0 and not equal to the weight of that edge.
Similarly, a vertex of the graph is called good if the bitwise XOR of the weights of its adjacent edges is not equal to 0 and not equal to the weight of that vertex.
You need to determine how many ways there are to assign weights to the vertices and edges of the graph so that all vertices and edges are good. Since the answer can be quite large, you need to calculate the remainder of the answer divided by 998244353.
The first line contains two integers n and m \xe2\x80\x94 the number of vertices and the number of edges in the graph (2\xe2\x89\xa4n\xe2\x89\xa45\xe2\x8b\x85105, n\xe2\x88\x921\xe2\x89\xa4m\xe2\x89\xa4106).
Each of the next m lines contains three integers ai,bi, and di (1\xe2\x89\xa4ai,bi\xe2\x89\xa4n, ai\xe2\x89\xa0bi, 0\xe2\x89\xa4di\xe2\x89\xa4109), indicating that there is an edge in the graph connecting vertices ai and bi. Additionally, on this edge, there are di additional vertices. It is guaranteed that the given graph is connected, there are no multiple edges, loops, and any two distinct simple cycles of the graph do not have common vertices.
Output a single integer \xe2\x80\x94 the answer to the problem modulo 998244353.
In the first test, the graph is a simple cycle of 3 vertices. It can be shown, that there are exactly 12 ways to assign weights, to make all vertexes and edges good.
In the second test, the graph has the form of two simple cycles of 3 vertices connected by an edge. It can be shown that for such a graph there are no ways to arrange weights so that all vertices and edges are good." "3500  x198"
1893D "Colorful Constructive" "constructive algorithms, data structures, greedy" "You have nn colored cubes, the ii-th cube has color aiai.
You need to distribute all the cubes on shelves. There are a total of mm shelves, the ii-th shelf can hold sisi cubes. Also, s1+s2+\xe2\x80\xa6+sm=ns1+s2+\xe2\x80\xa6+sm=n.
Suppose on a shelf of size k there are cubes of colors c1,c2,\xe2\x80\xa6,ck, in this order. Then we define the colorfulness of the shelf as the minimum distance between two different cubes of the same color on the shelf. If all the cubes on the shelf have different colors, then the colorfulness is considered to be equal to the size of the shelf, that is, the number k.
More formally, the colorfulness of c1,c2,\xe2\x80\xa6,ck is defined as follows:
For each shelf, you are given the minimum required colorfulness, that is, you are given numbers d1,d2,\xe2\x80\xa6,dm, which mean that shelf i must have a colorfulness \xe2\x89\xa5di for all i.
Distribute the available cubes among the shelves to ensure the required colorfulness, or report that it is impossible.
Each test contains multiple test cases. The first line contains a single integer t (1\xe2\x89\xa4t\xe2\x89\xa4104) \xe2\x80\x94 the number of test cases. The description of the test cases follows.
The first line of each test case contains two integers n,m (1\xe2\x89\xa4m\xe2\x89\xa4n\xe2\x89\xa42\xe2\x8b\x85105) \xe2\x80\x94 the number of cubes and the number of shelves to distribute them to.
The second line of each test case contains n integers a1,a2,\xe2\x80\xa6,an (1\xe2\x89\xa4ai\xe2\x89\xa4n) \xe2\x80\x94 the colors of the cubes.
The third line of each test case contains m integers s1,s2,\xe2\x80\xa6,sm (1\xe2\x89\xa4si\xe2\x89\xa4n) \xe2\x80\x94 the sizes of the shelves. It\'s guaranteed, that s1+\xe2\x80\xa6+sm=n.
The fourth line of each test case contains m integers d1,d2,\xe2\x80\xa6,dm (1\xe2\x89\xa4di\xe2\x89\xa4si) \xe2\x80\x94 the minimum required colorfulness of the shelves.
It is guaranteed that the sum of n over all test cases does not exceed 2\xe2\x8b\x85105.
For each test case, if it is impossible to distribute the cubes on the shelves satisfying all the requirements, output a single number \xe2\x88\x921. Otherwise, output m lines, where the i-th line should contain si numbers representing the colors of the cubes on the i-th shelf, in the appropriate order." "2600  x930"
1893C "Freedom of Choice" "brute force, greedy, implementation" "Let\'s define the anti-beauty of a multiset {b1,b2,\xe2\x80\xa6,blen}{b1,b2,\xe2\x80\xa6,blen} as the number of occurrences of the number lenlen in the multiset.
You are given mm multisets, where the ii-th multiset contains ni distinct elements, specifically: ci,1 copies of the number ai,1, ci,2 copies of the number ai,2,\xe2\x80\xa6,ci,ni copies of the number ai,ni. It is guaranteed that ai,1<ai,2<\xe2\x80\xa6<ai,ni. You are also given numbers l1,l2,\xe2\x80\xa6,lm and r1,r2,\xe2\x80\xa6,rm such that 1\xe2\x89\xa4li\xe2\x89\xa4ri\xe2\x89\xa4ci,1+\xe2\x80\xa6+ci,ni.
Let\'s create a multiset X, initially empty. Then, for each i from 1 to m, you must perform the following action exactly once:
You need to choose v1,\xe2\x80\xa6,vm and the added numbers in such a way that the resulting multiset X has the minimum possible anti-beauty.
Each test consists of multiple test cases. The first line contains a single integer t (1\xe2\x89\xa4t\xe2\x89\xa4104) \xe2\x80\x94 the number of test cases. The description of the test cases follows.
The first line of each test case contains a single integer m (1\xe2\x89\xa4m\xe2\x89\xa4105) \xe2\x80\x94 the number of given multisets.
Then, for each i from 1 to m, a data block consisting of three lines is entered.
The first line of each block contains three integers ni,li,ri (1\xe2\x89\xa4ni\xe2\x89\xa4105,1\xe2\x89\xa4li\xe2\x89\xa4ri\xe2\x89\xa4ci,1+\xe2\x80\xa6+ci,ni\xe2\x89\xa41017) \xe2\x80\x94 the number of distinct numbers in the i-th multiset and the limits on the number of elements to be added to X from the i-th multiset.
The second line of the block contains ni integers ai,1,\xe2\x80\xa6,ai,ni (1\xe2\x89\xa4ai,1<\xe2\x80\xa6<ai,ni\xe2\x89\xa41017) \xe2\x80\x94 the distinct elements of the i-th multiset.
The third line of the block contains ni integers ci,1,\xe2\x80\xa6,ci,ni (1\xe2\x89\xa4ci,j\xe2\x89\xa41012) \xe2\x80\x94 the number of copies of the elements in the i-th multiset.
It is guaranteed that the sum of the values of m for all test cases does not exceed 105, and also the sum of ni for all blocks of all test cases does not exceed 105.
For each test case, output the minimum possible anti-beauty of the multiset X that you can achieve.
In the first test case, the multisets have the following form:
You can select the elements {10,11,11,11,12} from the first multiset, {12} from the second multiset, and {13,13,13,13} from the third multiset. Thus, X={10,11,11,11,12,12,13,13,13,13}. The size of X is 10, the number 10 appears exactly 1 time in X, so the anti-beauty of X is 1. It can be shown that it is not possible to achieve an anti-beauty less than 1." "2000  x2738"
1893B "Neutral Tonality" "constructive algorithms, greedy, sortings, two pointers" "You are given an array aa consisting of nn integers, as well as an array bb consisting of mm integers.
Let LIS(c)LIS(c) denote the length of the longest increasing subsequence of array cc. For example, LIS([2,1_,1,3_])LIS([2,1\xe2\x80\x93,1,3\xe2\x80\x93]) = 2, LIS([1_,7_,9_]) = 3, LIS([3,1_,2_,4_]) = 3.
You need to insert the numbers b1,b2,\xe2\x80\xa6,bm into the array a, at any positions, in any order. Let the resulting array be c1,c2,\xe2\x80\xa6,cn+m. You need to choose the positions for insertion in order to minimize LIS(c).
Formally, you need to find an array c1,c2,\xe2\x80\xa6,cn+m that simultaneously satisfies the following conditions:
Each test contains multiple test cases. The first line contains a single integer t (1\xe2\x89\xa4t\xe2\x89\xa4104) \xe2\x80\x94 the number of test cases. The description of the test cases follows.
The first line of each test case contains two integers n,m (1\xe2\x89\xa4n\xe2\x89\xa42\xe2\x8b\x85105,1\xe2\x89\xa4m\xe2\x89\xa42\xe2\x8b\x85105) \xe2\x80\x94 the length of array a and the length of array b.
The second line of each test case contains n integers a1,a2,\xe2\x80\xa6,an (1\xe2\x89\xa4ai\xe2\x89\xa4109) \xe2\x80\x94 the elements of the array a.
The third line of each test case contains m integers b1,b2,\xe2\x80\xa6,bm (1\xe2\x89\xa4bi\xe2\x89\xa4109) \xe2\x80\x94 the elements of the array b.
It is guaranteed that the sum of n over all test cases does not exceed 2\xe2\x8b\x85105, and the sum of m over all test cases does not exceed 2\xe2\x8b\x85105.
For each test case, output n+m numbers \xe2\x80\x94 the elements of the final array c1,c2,\xe2\x80\xa6,cn+m, obtained after the insertion, such that the value of LIS(c) is minimized. If there are several answers, you can output any of them.
In the first test case, LIS(a)=LIS([6,4])=1. We can insert the number 5 between 6 and 4, then LIS(c)=LIS([6,5,4])=1.
In the second test case, LIS([1_,7,2_,4_,5_]) = 4. After the insertion, c=[1,1,7,7,2,2,4,4,5,5]. It is easy to see that LIS(c)=4. It can be shown that it is impossible to achieve LIS(c) less than 4." "1700  x9015"
1893A "Anonymous Informant" "brute force, dfs and similar, graphs, implementation" "You are given an array b1,b2,\xe2\x80\xa6,bn.
An anonymous informant has told you that the array b was obtained as follows: initially, there existed an array a1,a2,\xe2\x80\xa6,an, after which the following two-component operation was performed k times:
As a result of k such operations, the array b1,b2,\xe2\x80\xa6,bn was obtained. You want to check if the words of the anonymous informant can be true or if they are guaranteed to be false.
\xe2\x80\xa0A number x is called a fixed point of the array a1,a2,\xe2\x80\xa6,an if 1\xe2\x89\xa4x\xe2\x89\xa4n and ax=x.
\xe2\x80\xa1A cyclic left shift of the array a1,a2,\xe2\x80\xa6,an is the array a2,\xe2\x80\xa6,an,a1.
Each test contains multiple test cases. The first line contains an integer t (1\xe2\x89\xa4t\xe2\x89\xa4104) \xe2\x80\x94 the number of test cases. The description of the test cases follows.
The first line of each test case contains two integers n,k (1\xe2\x89\xa4n\xe2\x89\xa42\xe2\x8b\x85105, 1\xe2\x89\xa4k\xe2\x89\xa4109) \xe2\x80\x94 the length of the array b and the number of operations performed.
The second line of each test case contains n integers b1,b2,\xe2\x80\xa6,bn (1\xe2\x89\xa4bi\xe2\x89\xa4109) \xe2\x80\x94 the elements of the array b.
It is guaranteed that the sum of the values of n for all test cases does not exceed 2\xe2\x8b\x85105.
For each test case, output ""Yes"" if the words of the anonymous informant can be true, and ""No"" if they are guaranteed to be false.
In the first test case, the array a could be equal to [3,2,3,4,3]. In the first operation, a fixed point x=2 was chosen, and after 2 left shifts, the array became [3,4,3,3,2]. In the second operation, a fixed point x=3 was chosen, and after 3 left shifts, the array became [3,2,3,4,3]. In the third operation, a fixed point x=3 was chosen again, and after 3 left shifts, the array became [4,3,3,2,3], which is equal to the array b.
In the second test case, the array a could be equal to [7,2,1]. After the operation with a fixed point x=2, the array became [1,7,2]. Then, after the operation with a fixed point x=1, the array returned to its initial state [7,2,1]. These same 2 operations (with x=2, and x=1) were repeated 49 times. So, after 100 operations, the array returned to [7,2,1].
In the third test case, it can be shown that there is no solution." "1400  x12528"
1891F "A Growing Tree" "data structures, dfs and similar, trees" "You are given a rooted tree with the root at vertex 1, initially consisting of a single vertex. Each vertex has a numerical value, initially set to 0. There are also q queries of two types: 
After all queries, output the numerical value of all of the vertices in the final tree.
The first line contains a single integer T (1\xe2\x89\xa4T\xe2\x89\xa4104) \xe2\x80\x94 the number of test cases. The descriptions of the test cases follow.
The first line of each test case contains a single integer q (1\xe2\x89\xa4q\xe2\x89\xa45\xe2\x8b\x85105) \xe2\x80\x94 the number of queries.
The following q lines can fall into two cases: 
It is guaranteed that the sum of q across all test cases does not exceed 5\xe2\x8b\x85105.
For each test case, output the numerical value of each vertex of the final tree after all queries have been performed.
In the first case, the final tree with the assigned numerical values will look like this: " "2000  x3864"
1891E "Brukhovich and Exams" "brute force, greedy, implementation, math, sortings" "The boy Smilo is learning algorithms with a teacher named Brukhovich.
Over the course of the year, Brukhovich will administer nn exams. For each exam, its difficulty ai is known, which is a non-negative integer.
Smilo doesn\'t like when the greatest common divisor of the difficulties of two consecutive exams is equal to 1. Therefore, he considers the sadness of the academic year to be the number of such pairs of exams. More formally, the sadness is the number of indices i (1\xe2\x89\xa4i\xe2\x89\xa4n\xe2\x88\x921) such that gcd(ai,ai+1)=1, where gcd(x,y) is the greatest common divisor of integers x and y.
Brukhovich wants to minimize the sadness of the year of Smilo. To do this, he can set the difficulty of any exam to 0. However, Brukhovich doesn\'t want to make his students\' lives too easy. Therefore, he will perform this action no more than k times.
Help Smilo determine the minimum sadness that Brukhovich can achieve if he performs no more than k operations.
As a reminder, the greatest common divisor (GCD) of two non-negative integers x and y is the maximum integer that is a divisor of both x and y and is denoted as gcd(x,y). In particular, gcd(x,0)=gcd(0,x)=x for any non-negative integer x.
The first line contains a single integer t (1\xe2\x89\xa4t\xe2\x89\xa4104) \xe2\x80\x94 the number of test cases. The descriptions of the test cases follow.
The first line of each test case contains two integers n and k (1\xe2\x89\xa4k\xe2\x89\xa4n\xe2\x89\xa4105) \xe2\x80\x94 the total number of exams and the maximum number of exams that can be simplified, respectively. 
The second line of each test case contains n integers a1,a2,a3,\xe2\x80\xa6,an \xe2\x80\x94 the elements of array a, which are the difficulties of the exams (0\xe2\x89\xa4ai\xe2\x89\xa4109).
It is guaranteed that the sum of n across all test cases does not exceed 105.
For each test case, output the minimum possible sadness that can be achieved by performing no more than k operations.
In the first test case, a sadness of 1 can be achieved. To this, you can simplify the second and fourth exams. After this, there will be only one pair of adjacent exams with a greatest common divisor (GCD) equal to one, which is the first and second exams.
In the second test case, a sadness of 0 can be achieved by simplifying the second and fourth exams." "2500  x852"
1891D "Suspicious logarithms" "binary search, brute force, math" "Let f(x) be the floor of the binary logarithm of x. In other words, f(x) is largest non-negative integer y, such that 2y does not exceed x.
Let g(x) be the floor of the logarithm of x with base f(x). In other words, g(x) is the largest non-negative integer z, such that f(x)z does not exceed x.
You are given q queries. The i-th query consists of two integers li and ri. The answer to the query is the sum of g(k) across all integers k, such that li\xe2\x89\xa4k\xe2\x89\xa4ri. Since the answers might be large, print them modulo 109+7.
The first line contains a single integer q \xe2\x80\x94 the number of queries (1\xe2\x89\xa4q\xe2\x89\xa4105).
The next q lines each contain two integers li and ri \xe2\x80\x94 the bounds of the i-th query (4\xe2\x89\xa4li\xe2\x89\xa4ri\xe2\x89\xa41018). 
For each query, output the answer to the query modulo 109+7.
The table below contains the values of the functions f(x) and g(x) for all x such that 1\xe2\x89\xa4x\xe2\x89\xa48. " "1900  x4011"
1891C "Smilo and Monsters" "binary search, constructive algorithms, greedy, sortings, two pointers" "A boy called Smilo is playing a new game! In the game, there are n hordes of monsters, and the i-th horde contains ai monsters. The goal of the game is to destroy all the monsters. To do this, you have two types of attacks and a combo counter x, initially set to 0:
Your task is to destroy all of the monsters, meaning that there should be no monsters left in any of the hordes. Smilo wants to win as quickly as possible, so he wants to the minimum number of attacks required to win the game. 
The first line contains a single integer t (1\xe2\x89\xa4t\xe2\x89\xa4104) \xe2\x80\x94 the number of test cases. The descriptions of the test cases follow.
The first line of each input data set contains a single integer n (1\xe2\x89\xa4n\xe2\x89\xa42\xe2\x8b\x85105) \xe2\x80\x94 the number of hordes of monsters.
The second line contains n integers a1,a2,\xe2\x80\xa6,an (1\xe2\x89\xa4ai\xe2\x89\xa4109) \xe2\x80\x94 the number of monsters in each horde.
It is guaranteed that the sum of n across all test cases does not exceed 2\xe2\x8b\x85105.
For each test case, out put the minimum number of attacks required to kill all monsters.
In the first test case, we can use an attack of the first type on the 1-st, 3-rd and 4-th hordes, and then use an attack of the second type to finish off the 2-nd horde. We need 4 attacks in total.
In the second test case, we can use an attack of the first type on the 1-st and 3-rd hordes, then use an attack of the second type to finish off the 2-nd horde, and then use an attack of the first type on the 4-th horde. We need 4 attacks in total.
In the fourth test case, we can use an attack of the first type once on the 1-st horde, twice on the 2-nd horde, and then use an attack of the second type on the 2-nd horde, and finally use an attack of the first type to finish off the 2-nd horde. We need 5 attacks in total." "1500  x13572"
1891B "Deja Vu" "brute force, math, sortings" "You are given an array a of length n, consisting of positive integers, and an array x of length q, also consisting of positive integers.
There are q modification. On the i-th modification (1\xe2\x89\xa4i\xe2\x89\xa4q), for each j (1\xe2\x89\xa4j\xe2\x89\xa4n), such that aj is divisible by 2xi, you add 2xi\xe2\x88\x921 to aj. Note that xi (1\xe2\x89\xa4xi\xe2\x89\xa430) is a positive integer not exceeding 30.
After all modification queries, you need to output the final array.
The first line contains a single integer t (1\xe2\x89\xa4t\xe2\x89\xa4104) \xe2\x80\x94 the number of test cases. The description of the test cases follows.
The first line of each test case contains two integers n and q (1\xe2\x89\xa4n,q\xe2\x89\xa4105) \xe2\x80\x94the length of the array a and the number of queries respectively.
The second line of each test case contains n integers a1,a2,a3,\xe2\x80\xa6,an \xe2\x80\x94 the elements of the array a (1\xe2\x89\xa4ai\xe2\x89\xa4109).
