1718F "Burenka, an Array and Queries" "data structures,math,number theory" "Eugene got Burenka an array a of length n of integers from 1 to m for her birthday. Burenka knows that Eugene really likes coprime integers (integers x and y such that they have only one common factor (equal to 1)) so she wants to to ask Eugene q questions about the present. Each time Burenka will choose a subsegment al,al+1,\xe2\x80\xa6,ar of array a, and compute the product of these numbers p=al\xe2\x8b\x85al+1\xe2\x8b\x85\xe2\x80\xa6\xe2\x8b\x85ar. Then she will ask Eugene to count the number of integers between 1 and C inclusive which are coprime with p. Help Eugene answer all the questions!" 3300
1718E Impressionism "constructive algorithms,graphs,implementation,math" "Burenka has two pictures a and b, which are tables of the same size n\xc3\x97m. Each cell of each painting has a color \xe2\x80\x94 a number from 0 to 2\xe2\x8b\x85105, and there are no repeating colors in any row or column of each of the two paintings, except color 0.Burenka wants to get a picture b from the picture a. To achieve her goal, Burenka can perform one of 2 operations: swap any two rows of a or any two of its columns. Tell Burenka if she can fulfill what she wants, and if so, tell her the sequence of actions.The rows are numbered from 1 to n from top to bottom, the columns are numbered from 1 to m from left to right." 3500
1718D "Permutation for Burenka" "data structures,graph matchings,greedy,math,trees" "We call an array a pure if all elements in it are pairwise distinct. For example, an array [1,7,9] is pure, [1,3,3,7] isn\'t, because 3 occurs twice in it.A pure array b is similar to a pure array c if their lengths n are the same and for all pairs of indices l, r, such that 1\xe2\x89\xa4l\xe2\x89\xa4r\xe2\x89\xa4n, it\'s true that argmax([bl,bl+1,\xe2\x80\xa6,br])=argmax([cl,cl+1,\xe2\x80\xa6,cr]), where argmax(x) is defined as the index of the largest element in x (which is unique for pure arrays). For example, argmax([3,4,2])=2, argmax([1337,179,57])=1.Recently, Tonya found out that Burenka really likes a permutation p of length n. Tonya decided to please her and give her an array a similar to p. He already fixed some elements of a, but exactly k elements are missing (in these positions temporarily ai=0). It is guaranteed that k\xe2\x89\xa52. Also, he has a set S of k\xe2\x88\x921 numbers.Tonya realized that he was missing one number to fill the empty places of a, so he decided to buy it. He has q options to buy. Tonya thinks that the number d suits him, if it is possible to replace all zeros in a with numbers from S and the number d, so that a becomes a pure array similar to p. For each option of d, output whether this number is suitable for him or not." 3300
1718C "Tonya and Burenka-179" "data structures,greedy,math,number theory" "Tonya was given an array of a of length n written on a postcard for his birthday. For some reason, the postcard turned out to be a cyclic array, so the index of the element located strictly to the right of the n-th is 1. Tonya wanted to study it better, so he bought a robot ""Burenka-179"".A program for Burenka is a pair of numbers (s,k), where 1\xe2\x89\xa4s\xe2\x89\xa4n, 1\xe2\x89\xa4k\xe2\x89\xa4n\xe2\x88\x921. Note that k cannot be equal to n. Initially, Tonya puts the robot in the position of the array s. After that, Burenka makes exactly n steps through the array. If at the beginning of a step Burenka stands in the position i, then the following happens:   The number ai is added to the usefulness of the program.  ""Burenka"" moves k positions to the right (i:=i+k is executed, if i becomes greater than n, then i:=i\xe2\x88\x92n). Help Tonya find the maximum possible usefulness of a program for ""Burenka"" if the initial usefulness of any program is 0.Also, Tony\'s friend Ilyusha asks him to change the array q times. Each time he wants to assign ap:=x for a given index p and a value x. You need to find the maximum possible usefulness of the program after each of these changes." 2400
1718B "Fibonacci Strings" "greedy,implementation,math,number theory" "In all schools in Buryatia, in the 1 class, everyone is told the theory of Fibonacci strings.""A block is a subsegment of a string where all the letters are the same and are bounded on the left and right by the ends of the string or by letters other than the letters in the block. A string is called a Fibonacci string if, when it is divided into blocks, their lengths in the order they appear in the string form the Fibonacci sequence (f0=f1=1, fi=fi\xe2\x88\x922+fi\xe2\x88\x921), starting from the zeroth member of this sequence. A string is called semi-Fibonacci if it possible to reorder its letters to get a Fibonacci string.""Burenka decided to enter the Buryat State University, but at the entrance exam she was given a difficult task. She was given a string consisting of the letters of the Buryat alphabet (which contains exactly k letters), and was asked if the given string is semi-Fibonacci. The string can be very long, so instead of the string, she was given the number of appearances of each letter (ci for the i-th letter) in that string. Unfortunately, Burenka no longer remembers the theory of Fibonacci strings, so without your help she will not pass the exam." 2000
1718A2 "Burenka and Traditions (hard version)" "data structures,dp,greedy" "This is the hard version of this problem. The difference between easy and hard versions is only the constraints on ai and on n. You can make hacks only if both versions of the problem are solved.Burenka is the crown princess of Buryatia, and soon she will become the n-th queen of the country. There is an ancient tradition in Buryatia \xe2\x80\x94 before the coronation, the ruler must show their strength to the inhabitants. To determine the strength of the n-th ruler, the inhabitants of the country give them an array of a of exactly n numbers, after which the ruler must turn all the elements of the array into zeros in the shortest time. The ruler can do the following two-step operation any number of times:   select two indices l and r, so that 1\xe2\x89\xa4l\xe2\x89\xa4r\xe2\x89\xa4n and a non-negative integer x, then  for all l\xe2\x89\xa4i\xe2\x89\xa4r assign ai:=ai\xe2\x8a\x95x, where \xe2\x8a\x95 denotes the bitwise XOR operation. It takes \xe2\x8c\x88r\xe2\x88\x92l+12\xe2\x8c\x89 seconds to do this operation, where \xe2\x8c\x88y\xe2\x8c\x89 denotes y rounded up to the nearest integer. Help Burenka calculate how much time she will need." 1900
1718A1 "Burenka and Traditions (easy version)" dp,greedy "This is the easy version of this problem. The difference between easy and hard versions is only the constraints on ai and on n. You can make hacks only if both versions of the problem are solved.Burenka is the crown princess of Buryatia, and soon she will become the n-th queen of the country. There is an ancient tradition in Buryatia \xe2\x80\x94 before the coronation, the ruler must show their strength to the inhabitants. To determine the strength of the n-th ruler, the inhabitants of the country give them an array of a of exactly n numbers, after which the ruler must turn all the elements of the array into zeros in the shortest time. The ruler can do the following two-step operation any number of times:   select two indices l and r, so that 1\xe2\x89\xa4l\xe2\x89\xa4r\xe2\x89\xa4n and a non-negative integer x, then  for all l\xe2\x89\xa4i\xe2\x89\xa4r assign ai:=ai\xe2\x8a\x95x, where \xe2\x8a\x95 denotes the bitwise XOR operation. It takes \xe2\x8c\x88r\xe2\x88\x92l+12\xe2\x8c\x89 seconds to do this operation, where \xe2\x8c\x88y\xe2\x8c\x89 denotes y rounded up to the nearest integer. Help Burenka calculate how much time she will need." 1800
1717F "Madoka and The First Session" "constructive algorithms,flows,graph matchings,graphs,implementation" "Oh no, on the first exam Madoka got this hard problem:Given integer n and m pairs of integers (vi,ui). Also there is an array b1,b2,\xe2\x80\xa6,bn, initially filled with zeros.Then for each index i, where 1\xe2\x89\xa4i\xe2\x89\xa4m, perform either bvi:=bvi\xe2\x88\x921 and bui:=bui+1, or bvi:=bvi+1 and bui:=bui\xe2\x88\x921. Note that exactly one of these operations should be performed for every i.Also there is an array s of length n consisting of 0 and 1. And there is an array a1,a2,\xe2\x80\xa6,an, where it is guaranteed, that if si=0 holds, then ai=0.Help Madoka and determine whenever it is possible to perform operations in such way that for every i, where si=1 it holds that ai=bi. If it possible you should also provide Madoka with a way to perform operations." 2500
1717E "Madoka and The Best University" "math,number theory" "Madoka wants to enter to ""Novosibirsk State University"", but in the entrance exam she came across a very difficult task:Given an integer n, it is required to calculate \xe2\x88\x91lcm(c,gcd(a,b)), for all triples of positive integers (a,b,c), where a+b+c=n.In this problem gcd(x,y) denotes the greatest common divisor of x and y, and lcm(x,y) denotes the least common multiple of x and y.Solve this problem for Madoka and help her to enter to the best university!" 2200
1717D "Madoka and The Corruption Scheme" "combinatorics,constructive algorithms,greedy,math" "Madoka decided to entrust the organization of a major computer game tournament ""OSU""!In this tournament, matches are held according to the ""Olympic system"". In other words, there are 2n participants in the tournament, numbered with integers from 1 to 2n. There are n rounds in total in the tournament. In the i-th round there are 2n\xe2\x88\x92i matches between two players (one of whom is right, the other is left), after which the winners go further along the tournament grid, and the losing participants are eliminated from the tournament. Herewith, the relative order in the next round does not change. And the winner of the tournament \xe2\x80\x94 is the last remaining participant.But the smaller the participant\'s number, the more he will pay Madoka if he wins, so Madoka wants the participant with the lowest number to win. To do this, she can arrange the participants in the first round as she likes, and also determine for each match who will win \xe2\x80\x94 the participant on the left or right.But Madoka knows that tournament sponsors can change the winner in matches no more than k times. (That is, if the participant on the left won before the change, then the participant on the right will win after the change, and if the participant on the right won, then the participant on the left will win after the change).  So, the first image shows the tournament grid that Madoka made, where the red lines denote who should win the match. And the second one shows the tournament grid, after one change in the outcome of the match by sponsors (a match between 1 and 3 players). Print the minimum possible number of the winner in the tournament, which Madoka can get regardless of changes in sponsors. But since the answer can be very large, output it modulo 109+7. Note that we need to minimize the answer, and only then take it modulo." 1900
1717C "Madoka and Formal Statement" greedy "Given an array of integer a1,a2,\xe2\x80\xa6,an. In one operation you can make ai:=ai+1 if i<n and ai\xe2\x89\xa4ai+1, or i=n and ai\xe2\x89\xa4a1.You need to check whether the array a1,a2,\xe2\x80\xa6,an can become equal to the array b1,b2,\xe2\x80\xa6,bn in some number of operations (possibly, zero). Two arrays a and b of length n are called equal if ai=bi for all integers i from 1 to n." 1300
1717B "Madoka and Underground Competitions" "constructive algorithms,implementation" "Madoka decided to participate in an underground sports programming competition. And there was exactly one task in it:A square table of size n\xc3\x97n, where n is a multiple of k, is called good if only the characters \'.\' and \'X\' are written in it, as well as in any subtable of size 1\xc3\x97k or k\xc3\x971, there is at least one character \'X\'. In other words, among any k consecutive vertical or horizontal cells, there must be at least one containing the character \'X\'.Output any good table that has the minimum possible number of characters \'X\', and also the symbol \'X\' is written in the cell (r,c). Rows are numbered from 1 to n from top to bottom, columns are numbered from 1 to n from left to right." 1100
1717A "Madoka and Strange Thoughts" "math,number theory" "Madoka is a very strange girl, and therefore she suddenly wondered how many pairs of integers (a,b) exist, where 1\xe2\x89\xa4a,b\xe2\x89\xa4n, for which lcm(a,b)gcd(a,b)\xe2\x89\xa43.In this problem, gcd(a,b) denotes the greatest common divisor of the numbers a and b, and lcm(a,b) denotes the smallest common multiple of the numbers a and b." 800
1716F "Bags with Balls" "combinatorics,dp,math,number theory" "There are n bags, each bag contains m balls with numbers from 1 to m. For every i\xe2\x88\x88[1,m], there is exactly one ball with number i in each bag.You have to take exactly one ball from each bag (all bags are different, so, for example, taking the ball 1 from the first bag and the ball 2 from the second bag is not the same as taking the ball 2 from the first bag and the ball 1 from the second bag). After that, you calculate the number of balls with odd numbers among the ones you have taken. Let the number of these balls be F.Your task is to calculate the sum of Fk over all possible ways to take n balls, one from each bag." 2500
1716E "Swap and Maximum Block" "bitmasks,data structures,dfs and similar,divide and conquer,dp" "You are given an array of length 2n. The elements of the array are numbered from 1 to 2n.You have to process q queries to this array. In the i-th query, you will be given an integer k (0\xe2\x89\xa4k\xe2\x89\xa4n\xe2\x88\x921). To process the query, you should do the following:  for every i\xe2\x88\x88[1,2n\xe2\x88\x922k] in ascending order, do the following: if the i-th element was already swapped with some other element during this query, skip it; otherwise, swap ai and ai+2k;  after that, print the maximum sum over all contiguous subsegments of the array (including the empty subsegment). For example, if the array a is [\xe2\x88\x923,5,\xe2\x88\x923,2,8,\xe2\x88\x9220,6,\xe2\x88\x921], and k=1, the query is processed as follows:  the 1-st element wasn\'t swapped yet, so we swap it with the 3-rd element;  the 2-nd element wasn\'t swapped yet, so we swap it with the 4-th element;  the 3-rd element was swapped already;  the 4-th element was swapped already;  the 5-th element wasn\'t swapped yet, so we swap it with the 7-th element;  the 6-th element wasn\'t swapped yet, so we swap it with the 8-th element. So, the array becomes [\xe2\x88\x923,2,\xe2\x88\x923,5,6,\xe2\x88\x921,8,\xe2\x88\x9220]. The subsegment with the maximum sum is [5,6,\xe2\x88\x921,8], and the answer to the query is 18.Note that the queries actually change the array, i.\xe2\x80\x89e. after a query is performed, the array does not return to its original state, and the next query will be applied to the modified array." 2500
1716D "Chip Move" "brute force,dp,math" "There is a chip on the coordinate line. Initially, the chip is located at the point 0. You can perform any number of moves; each move increases the coordinate of the chip by some positive integer (which is called the length of the move). The length of the first move you make should be divisible by k, the length of the second move \xe2\x80\x94 by k+1, the third \xe2\x80\x94 by k+2, and so on.For example, if k=2, then the sequence of moves may look like this: 0\xe2\x86\x924\xe2\x86\x927\xe2\x86\x9219\xe2\x86\x9244, because 4\xe2\x88\x920=4 is divisible by 2=k, 7\xe2\x88\x924=3 is divisible by 3=k+1, 19\xe2\x88\x927=12 is divisible by 4=k+2, 44\xe2\x88\x9219=25 is divisible by 5=k+3.You are given two positive integers n and k. Your task is to count the number of ways to reach the point x, starting from 0, for every x\xe2\x88\x88[1,n]. The number of ways can be very large, so print it modulo 998244353. Two ways are considered different if they differ as sets of visited positions." 2000
1716C "Robot in a Hallway" "data structures,dp,greedy,implementation,ternary search" "There is a grid, consisting of 2 rows and m columns. The rows are numbered from 1 to 2 from top to bottom. The columns are numbered from 1 to m from left to right.The robot starts in a cell (1,1). In one second, it can perform either of two actions:   move into a cell adjacent by a side: up, right, down or left;  remain in the same cell. The robot is not allowed to move outside the grid.Initially, all cells, except for the cell (1,1), are locked. Each cell (i,j) contains a value ai,j \xe2\x80\x94 the moment that this cell gets unlocked. The robot can only move into a cell (i,j) if at least ai,j seconds have passed before the move.The robot should visit all cells without entering any cell twice or more (cell (1,1) is considered entered at the start). It can finish in any cell.What is the fastest the robot can achieve that?" 2000
1716B "Permutation Chain" "constructive algorithms,math" "A permutation of length n is a sequence of integers from 1 to n such that each integer appears in it exactly once.Let the fixedness of a permutation p be the number of fixed points in it \xe2\x80\x94 the number of positions j such that pj=j, where pj is the j-th element of the permutation p.You are asked to build a sequence of permutations a1,a2,\xe2\x80\xa6, starting from the identity permutation (permutation a1=[1,2,\xe2\x80\xa6,n]). Let\'s call it a permutation chain. Thus, ai is the i-th permutation of length n.For every i from 2 onwards, the permutation ai should be obtained from the permutation ai\xe2\x88\x921 by swapping any two elements in it (not necessarily neighboring). The fixedness of the permutation ai should be strictly lower than the fixedness of the permutation ai\xe2\x88\x921.Consider some chains for n=3:  a1=[1,2,3], a2=[1,3,2] \xe2\x80\x94 that is a valid chain of length 2. From a1 to a2, the elements on positions 2 and 3 get swapped, the fixedness decrease from 3 to 1.  a1=[2,1,3], a2=[3,1,2] \xe2\x80\x94 that is not a valid chain. The first permutation should always be [1,2,3] for n=3.  a1=[1,2,3], a2=[1,3,2], a3=[1,2,3] \xe2\x80\x94 that is not a valid chain. From a2 to a3, the elements on positions 2 and 3 get swapped but the fixedness increase from 1 to 3.  a1=[1,2,3], a2=[3,2,1], a3=[3,1,2] \xe2\x80\x94 that is a valid chain of length 3. From a1 to a2, the elements on positions 1 and 3 get swapped, the fixedness decrease from 3 to 1. From a2 to a3, the elements on positions 2 and 3 get swapped, the fixedness decrease from 1 to 0. Find the longest permutation chain. If there are multiple longest answers, print any of them." 800
1716A "2-3 Moves" greedy,math "You are standing at the point 0 on a coordinate line. Your goal is to reach the point n. In one minute, you can move by 2 or by 3 to the left or to the right (i.\xe2\x80\x89e., if your current coordinate is x, it can become x\xe2\x88\x923, x\xe2\x88\x922, x+2 or x+3). Note that the new coordinate can become negative.Your task is to find the minimum number of minutes required to get from the point 0 to the point n.You have to answer t independent test cases." 800
1715F "Crop Squares" "constructive algorithms,geometry,interactive,math" "This is an interactive problem.Farmer Stanley grows corn on a rectangular field of size n\xc3\x97m meters with corners in points (0,0), (0,m), (n,0), (n,m). This year the harvest was plentiful and corn covered the whole field.The night before harvest aliens arrived and poisoned the corn in a single 1\xc3\x971 square with sides parallel to field borders. The corn inside the square must not be eaten, but you cannot distinguish it from ordinary corn by sight. Stanley can only collect a sample of corn from an arbitrary polygon and bring it to the laboratory, where it will be analyzed and Stanley will be told the amount of corn in the sample that was poisoned. Since the harvest will soon deteriorate, such a study can be carried out no more than 5 times.More formally, it is allowed to make no more than 5 queries, each of them calculates the area of intersection of a chosen polygon with a square of poisoned corn. It is necessary to find out the coordinates of the lower-left corner of the drawn square (the vertex of the square with the smallest x and y coordinates)." 2700
1715E "Long Way Home" "data structures,divide and conquer,dp,geometry,graphs,greedy,shortest paths" "Stanley lives in a country that consists of n cities (he lives in city 1). There are bidirectional roads between some of the cities, and you know how long it takes to ride through each of them. Additionally, there is a flight between each pair of cities, the flight between cities u and v takes (u\xe2\x88\x92v)2 time.Stanley is quite afraid of flying because of watching ""Sully: Miracle on the Hudson"" recently, so he can take at most k flights. Stanley wants to know the minimum time of a journey to each of the n cities from the city 1." 2400
1715D "2+ doors" 2-sat,bitmasks,graphs,greedy "The Narrator has an integer array a of length n, but he will only tell you the size n and q statements, each of them being three integers i,j,x, which means that ai\xe2\x88\xa3aj=x, where | denotes the bitwise OR operation.Find the lexicographically smallest array a that satisfies all the statements.An array a is lexicographically smaller than an array b of the same length if and only if the following holds:   in the first position where a and b differ, the array a has a smaller element than the corresponding element in b." 1900
1715C Monoblock "combinatorics,data structures,implementation,math" "Stanley has decided to buy a new desktop PC made by the company ""Monoblock"", and to solve captcha on their website, he needs to solve the following task.The awesomeness of an array is the minimum number of blocks of consecutive identical numbers in which the array could be split. For example, the awesomeness of an array   [1,1,1] is 1;  [5,7] is 2, as it could be split into blocks [5] and [7];  [1,7,7,7,7,7,7,7,9,9,9,9,9,9,9,9,9] is 3, as it could be split into blocks [1], [7,7,7,7,7,7,7], and [9,9,9,9,9,9,9,9,9]. You are given an array a of length n. There are m queries of two integers i, x. A query i, x means that from now on the i-th element of the array a is equal to x.After each query print the sum of awesomeness values among all subsegments of array a. In other words, after each query you need to calculate n\xe2\x88\x91l=1n\xe2\x88\x91r=lg(l,r), where g(l,r) is the awesomeness of the array b=[al,al+1,\xe2\x80\xa6,ar]." 1700
1715B "Beautiful Array" "constructive algorithms,greedy,math" "Stanley defines the beauty of an array a of length n, which contains non-negative integers, as follows: n\xe2\x88\x91i=1\xe2\x8c\x8aaik\xe2\x8c\x8b, which means that we divide each element by k, round it down, and sum up the resulting values.Stanley told Sam the integer k and asked him to find an array a of n non-negative integers, such that the beauty is equal to b and the sum of elements is equal to s. Help Sam \xe2\x80\x94 find any of the arrays satisfying the conditions above." 1000
1715A Crossmarket "constructive algorithms,greedy,math" "Stanley and Megan decided to shop in the ""Crossmarket"" grocery store, which can be represented as a matrix with n rows and m columns. Stanley and Megan can move to an adjacent cell using 1 unit of power. Two cells are considered adjacent if they share an edge. To speed up the shopping process, Megan brought her portals with her, and she leaves one in each cell she visits (if there is no portal yet). If a person (Stanley or Megan) is in a cell with a portal, that person can use 1 unit of power to teleport to any other cell with a portal, including Megan\'s starting cell.They decided to split up: Stanley will go from the upper-left cell (cell with coordinates (1,1)) to the lower-right cell (cell with coordinates (n,m)), whilst Megan needs to get from the lower-left cell (cell with coordinates (n,1)) to the upper-right cell (cell with coordinates (1,m)).What is the minimum total energy needed for them both to do that?Note that they can choose the time they move. Time does not affect energy." 800
