2009F "Firefly\'s Queries" "bitmasks,data structures,flows,math" "Firefly is given an array a of length n. Let ci denote the i\'th cyclic shift\xe2\x88\x97 of a. She creates a new array b such that b=c1+c2+\xe2\x8b\xaf+cn where + represents concatenation\xe2\x80\xa0. Then, she asks you q queries. For each query, output the sum of all elements in the subarray of b that starts from the l-th element and ends at the r-th element, inclusive of both ends.\xe2\x88\x97The x-th (1\xe2\x89\xa4x\xe2\x89\xa4n) cyclic shift of the array a is ax,ax+1\xe2\x80\xa6an,a1,a2\xe2\x80\xa6ax\xe2\x88\x921. Note that the 1-st shift is the initial a.\xe2\x80\xa0The concatenation of two arrays p and q of length n (in other words, p+q) is p1,p2,...,pn,q1,q2,...,qn." 1700
2009E "Klee\'s SUPER DUPER LARGE Array!!!" "binary search,math,ternary search" "Klee has an array a of length n containing integers [k,k+1,...,k+n\xe2\x88\x921] in that order. Klee wants to choose an index i (1\xe2\x89\xa4i\xe2\x89\xa4n) such that x=|a1+a2+\xe2\x8b\xaf+ai\xe2\x88\x92ai+1\xe2\x88\x92\xe2\x8b\xaf\xe2\x88\x92an| is minimized. Note that for an arbitrary integer z, |z| represents the absolute value of z. Output the minimum possible value of x." 1400
2009D "Satyam and Counting" geometry,math "Satyam is given n distinct points on the 2D coordinate plane. It is guaranteed that 0\xe2\x89\xa4yi\xe2\x89\xa41 for all given points (xi,yi). How many different nondegenerate right triangles\xe2\x88\x97 can be formed from choosing three different points as its vertices?Two triangles a and b are different if there is a point v such that v is a vertex of a but not a vertex of b.\xe2\x88\x97A nondegenerate right triangle has positive area and an interior 90\xe2\x88\x98 angle." 1400
2009C "The Legend of Freya the Frog" implementation,math "Freya the Frog is traveling on the 2D coordinate plane. She is currently at point (0,0) and wants to go to point (x,y). In one move, she chooses an integer d such that 0\xe2\x89\xa4d\xe2\x89\xa4k and jumps d spots forward in the direction she is facing. Initially, she is facing the positive x direction. After every move, she will alternate between facing the positive x direction and the positive y direction (i.e., she will face the positive y direction on her second move, the positive x direction on her third move, and so on). What is the minimum amount of moves she must perform to land on point (x,y)?" 1100
2009B osu!mania "brute force,implementation" "You are playing your favorite rhythm game, osu!mania. The layout of your beatmap consists of n rows and 4 columns. Because notes at the bottom are closer, you will process the bottommost row first and the topmost row last. Each row will contain exactly one note, represented as a \'#\'.For each note 1,2,\xe2\x80\xa6,n, in the order of processing, output the column in which the note appears." 800
2009A Minimize! "brute force,math" "You are given two integers a and b (a\xe2\x89\xa4b). Over all possible integer values of c (a\xe2\x89\xa4c\xe2\x89\xa4b), find the minimum value of (c\xe2\x88\x92a)+(b\xe2\x88\x92c)." 800
2008H "Sakurako\'s Test" "binary search,brute force,greedy,math,number theory" "Sakurako will soon take a test. The test can be described as an array of integers n and a task on it:Given an integer x, Sakurako can perform the following operation any number of times:  Choose an integer i (1\xe2\x89\xa4i\xe2\x89\xa4n) such that ai\xe2\x89\xa5x;  Change the value of ai to ai\xe2\x88\x92x. Using this operation any number of times, she must find the minimum possible median\xe2\x88\x97 of the array a.Sakurako knows the array but does not know the integer x. Someone let it slip that one of the q values of x will be in the next test, so Sakurako is asking you what the answer is for each such x.\xe2\x88\x97The median of an array of length n is the element that stands in the middle of the sorted array (at the n+22-th position for even n, and at the n+12-th for odd)" 2100
2008G "Sakurako\'s Task" "binary search,greedy,math,number theory" "Sakurako has prepared a task for you:She gives you an array of n integers and allows you to choose i and j such that i\xe2\x89\xa0j and ai\xe2\x89\xa5aj, and then assign ai=ai\xe2\x88\x92aj or ai=ai+aj. You can perform this operation any number of times for any i and j, as long as they satisfy the conditions.Sakurako asks you what is the maximum possible value of mexk\xe2\x88\x97 of the array after any number of operations.\xe2\x88\x97mexk is the k-th non-negative integer that is absent in the array. For example, mex1({1,2,3})=0, since 0 is the first element that is not in the array, and mex2({0,2,4})=3, since 3 is the second element that is not in the array." 1800
2008F "Sakurako\'s Box" "combinatorics,math,number theory" "Sakurako has a box with n balls. Each ball has it\'s value. She wants to bet with her friend that if the friend randomly picks two balls from the box (it could be two distinct balls, but they may have the same value), the product of their values will be the same as the number that Sakurako guessed.Since Sakurako has a PhD in probability, she knows that the best number to pick is the expected value, but she forgot how to calculate it. Help Sakurako and find the expected value of the product of two elements from the array.It can be shown that the expected value has the form PQ, where P and Q are non-negative integers, and Q\xe2\x89\xa00. Report the value of P\xe2\x8b\x85Q\xe2\x88\x921(mod109+7)." 1400
2008E "Alternating String" "brute force,data structures,dp,greedy,implementation,strings" "Sakurako really loves alternating strings. She calls a string s of lowercase Latin letters an alternating string if characters in the even positions are the same, if characters in the odd positions are the same, and the length of the string is even.For example, the strings \'abab\' and \'gg\' are alternating, while the strings \'aba\' and \'ggwp\' are not.As a good friend, you decided to gift such a string, but you couldn\'t find one. Luckily, you can perform two types of operations on the string:   Choose an index i and delete the i-th character from the string, which will reduce the length of the string by 1. This type of operation can be performed no more than 1 time;  Choose an index i and replace si with any other letter. Since you are in a hurry, you need to determine the minimum number of operations required to make the string an alternating one." 1500
2008D "Sakurako\'s Hobby" dp,dsu,graphs,math "For a certain permutation p\xe2\x88\x97 Sakurako calls an integer j reachable from an integer i if it is possible to make i equal to j by assigning i=pi a certain number of times.If p=[3,5,6,1,2,4], then, for example, 4 is reachable from 1, because: i=1 \xe2\x86\x92 i=p1=3 \xe2\x86\x92 i=p3=6 \xe2\x86\x92 i=p6=4. Now i=4, so 4 is reachable from 1.Each number in the permutation is colored either black or white.Sakurako defines the function F(i) as the number of black integers that are reachable from i.Sakurako is interested in F(i) for each 1\xe2\x89\xa4i\xe2\x89\xa4n, but calculating all values becomes very difficult, so she asks you, as her good friend, to compute this.\xe2\x88\x97A permutation of length n is an array consisting of n distinct integers from 1 to n in arbitrary order. For example, [2,3,1,5,4] is a permutation, but [1,2,2] is not a permutation (the number 2 appears twice in the array), and [1,3,4] is also not a permutation (n=3, but the array contains 4)." 1100
2008C "Longest Good Array" "binary search,brute force,math" "Today, Sakurako was studying arrays. An array a of length n is considered good if and only if:  the array a is increasing, meaning ai\xe2\x88\x921<ai for all 2\xe2\x89\xa4i\xe2\x89\xa4n;  the differences between adjacent elements are increasing, meaning ai\xe2\x88\x92ai\xe2\x88\x921<ai+1\xe2\x88\x92ai for all 2\xe2\x89\xa4i<n. Sakurako has come up with boundaries l and r and wants to construct a good array of maximum length, where l\xe2\x89\xa4ai\xe2\x89\xa4r for all ai.Help Sakurako find the maximum length of a good array for the given l and r." 800
2008B "Square or Not" "brute force,math,strings" "A beautiful binary matrix is a matrix that has ones on its edges and zeros inside.  Examples of four beautiful binary matrices. Today, Sakurako was playing with a beautiful binary matrix of size r\xc3\x97c and created a binary string s by writing down all the rows of the matrix, starting from the first and ending with the r-th. More formally, the element from the matrix in the i-th row and j-th column corresponds to the ((i\xe2\x88\x921)\xe2\x88\x97c+j)-th element of the string.You need to check whether the beautiful matrix from which the string s was obtained could be squared. In other words, you need to check whether the string s could have been build from a square beautiful binary matrix (i.e., one where r=c)." 800
2008A "Sakurako\'s Exam" "brute force,constructive algorithms,greedy,math" "Today, Sakurako has a math exam. The teacher gave the array, consisting of a ones and b twos.In an array, Sakurako must place either a \'+\' or a \'-\' in front of each element so that the sum of all elements in the array equals 0.Sakurako is not sure if it is possible to solve this problem, so determine whether there is a way to assign signs such that the sum of all elements in the array equals 0." 800
2007C "Dora and C++" "math,number theory" "Dora has just learned the programming language C++!However, she has completely misunderstood the meaning of C++. She considers it as two kinds of adding operations on the array c with n elements. Dora has two integers a and b. In one operation, she can choose one of the following things to do.  Choose an integer i such that 1\xe2\x89\xa4i\xe2\x89\xa4n, and increase ci by a.  Choose an integer i such that 1\xe2\x89\xa4i\xe2\x89\xa4n, and increase ci by b. Note that a and b are constants, and they can be the same.Let\'s define a range of array d as max(di)\xe2\x88\x92min(di). For instance, the range of the array [1,2,3,4] is 4\xe2\x88\x921=3, the range of the array [5,2,8,2,2,1] is 8\xe2\x88\x921=7, and the range of the array [3,3,3] is 3\xe2\x88\x923=0.After any number of operations (possibly, 0), Dora calculates the range of the new array. You need to help Dora minimize this value, but since Dora loves exploring all by herself, you only need to tell her the minimized value." 1500
2007B "Index and Maximum Value" "data structures,greedy" "After receiving yet another integer array a1,a2,\xe2\x80\xa6,an at her birthday party, Index decides to perform some operations on it.Formally, there are m operations that she is going to perform in order. Each of them belongs to one of the two types:  + l r. Given two integers l and r, for all 1\xe2\x89\xa4i\xe2\x89\xa4n such that l\xe2\x89\xa4ai\xe2\x89\xa4r, set ai:=ai+1.  - l r. Given two integers l and r, for all 1\xe2\x89\xa4i\xe2\x89\xa4n such that l\xe2\x89\xa4ai\xe2\x89\xa4r, set ai:=ai\xe2\x88\x921. For example, if the initial array a=[7,1,3,4,3], after performing the operation + 2 4, the array a=[7,1,4,5,4]. Then, after performing the operation - 1 10, the array a=[6,0,3,4,3].Index is curious about the maximum value in the array a. Please help her find it after each of the m operations." 900
2007A "Dora\'s Set" "greedy,math,number theory" "Dora has a set s containing integers. In the beginning, she will put all integers in [l,r] into the set s. That is, an integer x is initially contained in the set if and only if l\xe2\x89\xa4x\xe2\x89\xa4r. Then she allows you to perform the following operations:  Select three distinct integers a, b, and c from the set s, such that gcd(a,b)=gcd(b,c)=gcd(a,c)=1\xe2\x80\xa0.  Then, remove these three integers from the set s. What is the maximum number of operations you can perform?\xe2\x80\xa0Recall that gcd(x,y) means the greatest common divisor of integers x and y." 800
2006F "Dora\'s Paint" "brute force,combinatorics,constructive algorithms,graphs,implementation" "Sadly, Dora poured the paint when painting the class mural. Dora considers the mural as the matrix b of size n\xc3\x97n. Initially, bi,j=0 for all 1\xe2\x89\xa4i,j\xe2\x89\xa4n.Dora has only two brushes which have two different colors. In one operation, she can paint the matrix with one of two brushes:  The first brush has color 1 on it and can paint one column of the matrix. That is, Dora chooses 1\xe2\x89\xa4j\xe2\x89\xa4n and makes bi,j:=1 for all 1\xe2\x89\xa4i\xe2\x89\xa4n;  The second brush has color 2 on it and can paint one row of the matrix. That is, Dora chooses 1\xe2\x89\xa4i\xe2\x89\xa4n and makes bi,j:=2 for all 1\xe2\x89\xa4j\xe2\x89\xa4n. Dora paints the matrix so that the resulting matrix b contains only 1 and 2.For a matrix b, let f(b) denote the minimum number of operations needed to turn the initial matrix (containing only 0) into b. The beauty of a matrix b is the number of ways to paint the initial matrix in exactly f(b) operations to turn it into b. If there\'s no way to turn the initial matrix into b, the beauty of b is 0.However, Dora made a uniformly random mistake; there\'s exactly one element different in the matrix a given to you from the real matrix b. That is, there is exactly one pair (i,j) such that ai,j=3\xe2\x88\x92bi,j.Please help Dora compute the expected beauty of the real matrix b modulo 998244353 (all possible n2 mistakes have equal probability).Since the size of the matrix is too large, Dora will only tell you the positions of m elements of color 1, and the remaining n2\xe2\x88\x92m elements have color 2." 3500
2006E "Iris\'s Full Binary Tree" "brute force,data structures,dfs and similar,trees" "Iris likes full binary trees.Let\'s define the depth of a rooted tree as the maximum number of vertices on the simple paths from some vertex to the root. A full binary tree of depth d is a binary tree of depth d with exactly 2d\xe2\x88\x921 vertices.Iris calls a tree a d-binary tree if some vertices and edges can be added to it to make it a full binary tree of depth d. Note that any vertex can be chosen as the root of a full binary tree.Since performing operations on large trees is difficult, she defines the binary depth of a tree as the minimum d satisfying that the tree is d-binary. Specifically, if there is no integer d\xe2\x89\xa51 such that the tree is d-binary, the binary depth of the tree is \xe2\x88\x921.Iris now has a tree consisting of only vertex 1. She wants to add n\xe2\x88\x921 more vertices to form a larger tree. She will add the vertices one by one. When she adds vertex i (2\xe2\x89\xa4i\xe2\x89\xa4n), she\'ll give you an integer pi (1\xe2\x89\xa4pi<i), and add a new edge connecting vertices i and pi.Iris wants to ask you the binary depth of the tree formed by the first i vertices for each 1\xe2\x89\xa4i\xe2\x89\xa4n. Can you tell her the answer?" 3100
2006D "Iris and Adjacent Products" "data structures,greedy,implementation,math" "Iris has just learned multiplication in her Maths lessons. However, since her brain is unable to withstand too complex calculations, she could not multiply two integers with the product greater than k together. Otherwise, her brain may explode!Her teacher sets a difficult task every day as her daily summer holiday homework. Now she is given an array a consisting of n elements, and she needs to calculate the product of each two adjacent elements (that is, a1\xe2\x8b\x85a2, a2\xe2\x8b\x85a3, and so on). Iris wants her brain to work safely, and in order to do that, she would like to modify the array a in such a way that ai\xe2\x8b\x85ai+1\xe2\x89\xa4k holds for every 1\xe2\x89\xa4i<n. There are two types of operations she can perform:  She can rearrange the elements of the array a in an arbitrary way. She can select an arbitrary element of the array a and change its value to an arbitrary integer from 1 to k. Iris wants to minimize the number of operations of type 2 that she uses.However, that\'s completely not the end of the summer holiday! Summer holiday lasts for q days, and on the i-th day, Iris is asked to solve the Math homework for the subarray bli,bli+1,\xe2\x80\xa6,bri. Help Iris and tell her the minimum number of type 2 operations she needs to perform for each day. Note that the operations are independent for each day, i.e. the array b is not changed." 2600
2006C "Eri and Expanded Sets" "data structures,divide and conquer,math,number theory,two pointers" "Let there be a set that contains distinct positive integers. To expand the set to contain as many integers as possible, Eri can choose two integers x\xe2\x89\xa0y from the set such that their average x+y2 is still a positive integer and isn\'t contained in the set, and add it to the set. The integers x and y remain in the set.Let\'s call the set of integers consecutive if, after the elements are sorted, the difference between any pair of adjacent elements is 1. For example, sets {2}, {2,5,4,3}, {5,6,8,7} are consecutive, while {2,4,5,6}, {9,7} are not.Eri likes consecutive sets. Suppose there is an array b, then Eri puts all elements in b into the set. If after a finite number of operations described above, the set can become consecutive, the array b will be called brilliant.Note that if the same integer appears in the array multiple times, we only put it into the set once, as a set always contains distinct positive integers.Eri has an array a of n positive integers. Please help him to count the number of pairs of integers (l,r) such that 1\xe2\x89\xa4l\xe2\x89\xa4r\xe2\x89\xa4n and the subarray al,al+1,\xe2\x80\xa6,ar is brilliant." 2300
2006B "Iris and the Tree" "brute force,data structures,dfs and similar,dsu,math,trees" "Given a rooted tree with the root at vertex 1. For any vertex i (1<i\xe2\x89\xa4n) in the tree, there is an edge connecting vertices i and pi (1\xe2\x89\xa4pi<i), with a weight equal to ti.Iris does not know the values of ti, but she knows that n\xe2\x88\x91i=2ti=w and each of the ti is a non-negative integer.The vertices of the tree are numbered in a special way: the numbers of the vertices in each subtree are consecutive integers. In other words, the vertices of the tree are numbered in the order of a depth-first search.  The tree in this picture satisfies the condition. For example, in the subtree of vertex 2, the vertex numbers are 2,3,4,5, which are consecutive integers.   The tree in this picture does not satisfy the condition, as in the subtree of vertex 2, the vertex numbers 2 and 4 are not consecutive integers. We define dist(u,v) as the length of the simple path between vertices u and v in the tree.Next, there will be n\xe2\x88\x921 events:  Iris is given integers x and y, indicating that tx=y. After each event, Iris wants to know the maximum possible value of dist(i,imodn+1) independently for each i (1\xe2\x89\xa4i\xe2\x89\xa4n). She only needs to know the sum of these n values. Please help Iris quickly get the answers.Note that when calculating the maximum possible values of dist(i,imodn+1) and dist(j,jmodn+1) for i\xe2\x89\xa0j, the unknown edge weights may be different." 1800
2006A "Iris and Game on the Tree" "constructive algorithms,dfs and similar,games,graphs,greedy,trees" "Iris has a tree rooted at vertex 1. Each vertex has a value of 0 or 1.Let\'s consider a leaf of the tree (the vertex 1 is never considered a leaf) and define its weight. Construct a string formed by the values of the vertices on the path starting at the root and ending in this leaf. Then the weight of the leaf is the difference between the number of occurrences of 10 and 01 substrings in it.Take the following tree as an example. Green vertices have a value of 1 while white vertices have a value of 0.   Let\'s calculate the weight of the leaf 5: the formed string is 10110. The number of occurrences of substring 10 is 2, the number of occurrences of substring 01 is 1, so the difference is 2\xe2\x88\x921=1. Let\'s calculate the weight of the leaf 6: the formed string is 101. The number of occurrences of substring 10 is 1, the number of occurrences of substring 01 is 1, so the difference is 1\xe2\x88\x921=0.The score of a tree is defined as the number of leaves with non-zero weight in the tree.But the values of some vertices haven\'t been decided and will be given to you as ?. Filling the blanks would be so boring, so Iris is going to invite Dora to play a game. On each turn, one of the girls chooses any of the remaining vertices with value ? and changes its value to 0 or 1, with Iris going first. The game continues until there are no vertices with value ? left in the tree. Iris aims to maximize the score of the tree, while Dora aims to minimize that.Assuming that both girls play optimally, please determine the final score of the tree." 1700
2005E2 "Subtangle Game (Hard Version)" "data structures,dp,games,greedy,implementation" "This is the hard version of the problem. The differences between the two versions are the constraints on all the variables. You can make hacks only if both versions of the problem are solved.Tsovak and Narek are playing a game. They have an array a and a matrix b of integers with n rows and m columns, numbered from 1. The cell in the i-th row and the j-th column is (i,j).They are looking for the elements of a in turns; Tsovak starts first. Each time a player looks for a cell in the matrix containing the current element of a (Tsovak looks for the first, then Narek looks for the second, etc.). Let\'s say a player has chosen the cell (r,c). The next player has to choose his cell in the submatrix starting at (r+1,c+1) and ending in (n,m) (the submatrix can be empty if r=n or c=m). If a player cannot find such a cell (or the remaining submatrix is empty) or the array ends (the previous player has chosen the last element), then he loses.Your task is to determine the winner if the players play optimally.Note: since the input is large, you may need to optimize input/output for this problem.For example, in C++, it is enough to use the following lines at the start of the main() function: int main() {    ios_base::sync_with_stdio(false);    cin.tie(NULL); cout.tie(NULL);}" 2500
2005E1 "Subtangle Game (Easy Version)" dp,games,greedy,implementation "This is the easy version of the problem. The differences between the two versions are the constraints on all the variables. You can make hacks only if both versions of the problem are solved.Tsovak and Narek are playing a game. They have an array a and a matrix b of integers with n rows and m columns, numbered from 1. The cell in the i-th row and the j-th column is (i,j).They are looking for the elements of a in turns; Tsovak starts first. Each time a player looks for a cell in the matrix containing the current element of a (Tsovak looks for the first, then Narek looks for the second, etc.). Let\'s say a player has chosen the cell (r,c). The next player has to choose his cell in the submatrix starting at (r+1,c+1) and ending in (n,m) (the submatrix can be empty if r=n or c=m). If a player cannot find such a cell (or the remaining submatrix is empty) or the array ends (the previous player has chosen the last element), then he loses.Your task is to determine the winner if the players play optimally." 2100
2005D "Alter the GCD" "binary search,brute force,data structures,divide and conquer,implementation,number theory" "You are given two arrays a1,a2,\xe2\x80\xa6,an and b1,b2,\xe2\x80\xa6,bn.You must perform the following operation exactly once:  choose any indices l and r such that 1\xe2\x89\xa4l\xe2\x89\xa4r\xe2\x89\xa4n;  swap ai and bi for all i such that l\xe2\x89\xa4i\xe2\x89\xa4r. Find the maximum possible value of gcd(a1,a2,\xe2\x80\xa6,an)+gcd(b1,b2,\xe2\x80\xa6,bn) after performing the operation exactly once. Also find the number of distinct pairs (l,r) which achieve the maximum value." 2400
2005C "Lazy Narek" dp,implementation,strings "Narek is too lazy to create the third problem of this contest. His friend Artur suggests that he should use ChatGPT. ChatGPT creates n problems, each consisting of m letters, so Narek has n strings. To make the problem harder, he combines the problems by selecting some of the n strings possibly none and concatenating them without altering their order. His chance of solving the problem is defined as scoren\xe2\x88\x92scorec, where scoren is Narek\'s score and scorec is ChatGPT\'s score.Narek calculates scoren by examining the selected string (he moves from left to right). He initially searches for the letter ""n"", followed by ""a"", ""r"", ""e"", and ""k"". Upon finding all occurrences of these letters, he increments scoren by 5 and resumes searching for ""n"" again (he doesn\'t go back, and he just continues from where he left off). After Narek finishes, ChatGPT scans through the array and increments scorec by 1 for each letter ""n"", ""a"", ""r"", ""e"", or ""k"" that Narek fails to utilize (note that if Narek fails to complete the last occurrence by finding all of the 5 letters, then all of the letters he used are counted in ChatGPT\'s score scorec, and Narek doesn\'t get any points if he doesn\'t finish finding all the 5 letters).Narek aims to maximize the value of scoren\xe2\x88\x92scorec by selecting the most optimal subset of the initial strings." 1800
