2014E "Rendez-vous de Marian et Robin" "dfs and similar,graphs,shortest paths" "In the humble act of meeting, joy doth unfold like a flower in bloom.Absence makes the heart grow fonder. Marian sold her last ware at the Market at the same time Robin finished training at the Major Oak. They couldn\'t wait to meet, so they both start without delay.The travel network is represented as n vertices numbered from 1 to n and m edges. The i-th edge connects vertices ui and vi, and takes wi seconds to travel (all wi are even). Marian starts at vertex 1 (Market) and Robin starts at vertex n (Major Oak).In addition, h of the n vertices each has a single horse available. Both Marian and Robin are capable riders, and could mount horses in no time (i.e. in 0 seconds). Travel times are halved when riding. Once mounted, a horse lasts the remainder of the travel. Meeting must take place on a vertex (i.e. not on an edge). Either could choose to wait on any vertex.Output the earliest time Robin and Marian can meet. If vertices 1 and n are disconnected, output \xe2\x88\x921 as the meeting is cancelled." 1800
2014D "Robert Hood and Mrs Hood" "brute force,data structures,greedy,sortings" "Impress thy brother, yet fret not thy mother.Robin\'s brother and mother are visiting, and Robin gets to choose the start day for each visitor.All days are numbered from 1 to n. Visitors stay for d continuous days, all of those d days must be between day 1 and n inclusive.Robin has a total of k risky \'jobs\' planned. The i-th job takes place between days li and ri inclusive, for 1\xe2\x89\xa4i\xe2\x89\xa4k. If a job takes place on any of the d days, the visit overlaps with this job (the length of overlap is unimportant).Robin wants his brother\'s visit to overlap with the maximum number of distinct jobs, and his mother\'s the minimum.Find suitable start days for the visits of Robin\'s brother and mother. If there are multiple suitable days, choose the earliest one." 1400
2014C "Robin Hood in Town" "binary search,greedy,math" "In Sherwood, we judge a man not by his wealth, but by his merit.Look around, the rich are getting richer, and the poor are getting poorer. We need to take from the rich and give to the poor. We need Robin Hood!There are n people living in the town. Just now, the wealth of the i-th person was ai gold. But guess what? The richest person has found an extra pot of gold! More formally, find an aj=max(a1,a2,\xe2\x80\xa6,an), change aj to aj+x, where x is a non-negative integer number of gold found in the pot. If there are multiple maxima, it can be any one of them.A person is unhappy if their wealth is strictly less than half of the average wealth\xe2\x88\x97. If strictly more than half of the total population n are unhappy, Robin Hood will appear by popular demand.Determine the minimum value of x for Robin Hood to appear, or output \xe2\x88\x921 if it is impossible.\xe2\x88\x97The average wealth is defined as the total wealth divided by the total population n, that is, \xe2\x88\x91ain, the result is a real number." 1100
2014B "Robin Hood and the Major Oak" math "In Sherwood, the trees are our shelter, and we are all children of the forest.The Major Oak in Sherwood is known for its majestic foliage, which provided shelter to Robin Hood and his band of merry men and women.The Major Oak grows ii new leaves in the i-th year. It starts with 1 leaf in year 1.Leaves last for k years on the tree. In other words, leaves grown in year i last between years i and i+k\xe2\x88\x921 inclusive.Robin considers even numbers lucky. Help Robin determine whether the Major Oak will have an even number of leaves in year n." 800
2014A "Robin Helps" greedy,implementation "There is a little bit of the outlaw in everyone, and a little bit of the hero too.The heroic outlaw Robin Hood is famous for taking from the rich and giving to the poor.Robin encounters n people starting from the 1-st and ending with the n-th. The i-th person has ai gold. If ai\xe2\x89\xa5k, Robin will take all ai gold, and if ai=0, Robin will give 1 gold if he has any. Robin starts with 0 gold.Find out how many people Robin gives gold to." 800
2013F2 "Game in Tree (Hard Version)" "binary search,data structures,trees" "This is the hard version of the problem. In this version, it is not guaranteed that u=v. You can make hacks only if both versions of the problem are solved.Alice and Bob are playing a fun game on a tree. This game is played on a tree with n vertices, numbered from 1 to n. Recall that a tree with n vertices is an undirected connected graph with n\xe2\x88\x921 edges.Alice and Bob take turns, with Alice going first. Each player starts at some vertex.On their turn, a player must move from the current vertex to a neighboring vertex that has not yet been visited by anyone. The first player who cannot make a move loses.You are given two vertices u and v. Represent the simple path from vertex u to v as an array p1,p2,p3,\xe2\x80\xa6,pm, where p1=u, pm=v, and there is an edge between pi and pi+1 for all i (1\xe2\x89\xa4i<m).You need to determine the winner of the game if Alice starts at vertex 1 and Bob starts at vertex pj for each j (where 1\xe2\x89\xa4j\xe2\x89\xa4m)." 3500
2013F1 "Game in Tree (Easy Version)" "binary search,brute force,data structures,dp,games,greedy,implementation,trees" "This is the easy version of the problem. In this version, u=v. You can make hacks only if both versions of the problem are solved.Alice and Bob are playing a fun game on a tree. This game is played on a tree with n vertices, numbered from 1 to n. Recall that a tree with n vertices is an undirected connected graph with n\xe2\x88\x921 edges.Alice and Bob take turns, with Alice going first. Each player starts at some vertex.On their turn, a player must move from the current vertex to a neighboring vertex that has not yet been visited by anyone. The first player who cannot make a move loses.You are given two vertices u and v. Represent the simple path from vertex u to v as an array p1,p2,p3,\xe2\x80\xa6,pm, where p1=u, pm=v, and there is an edge between pi and pi+1 for all i (1\xe2\x89\xa4i<m).You need to determine the winner of the game if Alice starts at vertex 1 and Bob starts at vertex pj for each j (where 1\xe2\x89\xa4j\xe2\x89\xa4m)." 2700
2013E "Prefix GCD" "brute force,dp,greedy,math,number theory" "Since Mansur is tired of making legends, there will be no legends for this task.You are given an array of positive integer numbers a1,a2,\xe2\x80\xa6,an. The elements of the array can be rearranged in any order. You need to find the smallest possible value of the expression gcd(a1)+gcd(a1,a2)+\xe2\x80\xa6+gcd(a1,a2,\xe2\x80\xa6,an), where gcd(a1,a2,\xe2\x80\xa6,an) denotes the greatest common divisor (GCD) of a1,a2,\xe2\x80\xa6,an." 2200
2013D "Minimize the Difference" "binary search,greedy" "Zhan, tired after the contest, gave the only task that he did not solve during the contest to his friend, Sungat. However, he could not solve it either, so we ask you to try to solve this problem.You are given an array a1,a2,\xe2\x80\xa6,an of length n. We can perform any number (possibly, zero) of operations on the array.In one operation, we choose a position i (1\xe2\x89\xa4i\xe2\x89\xa4n\xe2\x88\x921) and perform the following action:   ai:=ai\xe2\x88\x921, and ai+1:=ai+1+1. Find the minimum possible value of max(a1,a2,\xe2\x80\xa6,an)\xe2\x88\x92min(a1,a2,\xe2\x80\xa6,an)." 1900
2013C "Password Cracking" "constructive algorithms,interactive,strings" "Dimash learned that Mansur wrote something very unpleasant about him to a friend, so he decided to find out his password at all costs and discover what exactly he wrote.Believing in the strength of his password, Mansur stated that his password \xe2\x80\x94 is a binary string of length n. He is also ready to answer Dimash\'s questions of the following type:Dimash says a binary string t, and Mansur replies whether it is true that t is a substring of his password.Help Dimash find out the password in no more than 2n operations; otherwise, Mansur will understand the trick and stop communicating with him." 1400
2013B "Battle for Survive" "constructive algorithms,greedy,math" "Eralim, being the mafia boss, manages a group of n fighters. Fighter i has a rating of ai.Eralim arranges a tournament of n\xe2\x88\x921 battles, in each of which two not yet eliminated fighters i and j (1\xe2\x89\xa4i<j\xe2\x89\xa4n) are chosen, and as a result of the battle, fighter i is eliminated from the tournament, and the rating of fighter j is reduced by the rating of fighter i. That is, aj is decreased by ai. Note that fighter j\'s rating can become negative. The fighters indexes do not change.Eralim wants to know what maximum rating the last remaining fighter can preserve if he chooses the battles optimally." 900
2013A "Zhan\'s Blender" "constructive algorithms,math" "Today, a club fair was held at ""NSPhM"". In order to advertise his pastry club, Zhan decided to demonstrate the power of his blender.To demonstrate the power of his blender, Zhan has n fruits.The blender can mix up to x fruits per second.In each second, Zhan can put up to y fruits into the blender. After that, the blender will blend min(x,c) fruits, where c is the number of fruits inside the blender. After blending, blended fruits are removed from the blender.Help Zhan determine the minimum amount of time required for Zhan to blend all fruits." 800
2011I "Stack and Queue" "*special problem,data structures,divide and conquer" "There are 2 queues of patients at the doors of two doctors. The first doctor sees patients in the usual order of the queue \xe2\x80\x94 whoever arrived first will be seen first. The second doctor does the opposite \xe2\x80\x94 he sees those who arrived last first. Thus, there is a queue for the first doctor and a stack for the second doctor. A patient can be in both the queue and the stack. Each patient is characterized by the time their visit to the doctor will take (the time is the same for both doctors).When the appointments begin, the doctors will see patients in the order of the queue and stack, respectively. As soon as a doctor finishes with one patient, he will call the next one.But there is one problem: if a patient is in both the queue and the stack, and he is called to one doctor first and then to the other, while he has not yet finished with the first one, confusion will arise. It is allowed for a patient to go to the second doctor at the exact moment he finishes with the first doctor.The current configuration of the queue and stack is called good if the doctors can see all the patients without any confusion arising.Initially, both the queue and the stack are empty. There are three types of queries:   add patient x to the queue;  add patient x to the stack;  patient x, who was in the queue, realizes he is in the wrong place and moves to the stack; however, he moves to the position in the stack as if he had entered the stack at the moment of the query when he entered the queue. It is guaranteed that after each query, each patient is no more than once in the queue and no more than once in the stack.After each query, you need to determine if the current configuration is good." -999
2011H "Strange Matrix" "*special problem,graphs,greedy" "You are given a matrix a of size n\xc3\x97m, consisting of integers from 0 to 31 inclusive.Let\'s call the matrix strange if for every two distinct rows i and j, both of the following conditions hold:   for every set of k indices (x1,x2,\xe2\x80\xa6,xk), where 1\xe2\x89\xa4x1<x2<\xe2\x8b\xaf<xk\xe2\x89\xa4m, the equality ai,x1&aj,x1&ai,x2&aj,x2&\xe2\x8b\xaf&ai,xk&aj,xk=0 holds (where & \xe2\x80\x94 bitwise AND of two numbers);  for every set of k indices (x1,x2,\xe2\x80\xa6,xk), where 1\xe2\x89\xa4x1<x2<\xe2\x8b\xaf<xk\xe2\x89\xa4m, the equality ai,x1|aj,x1|ai,x2|aj,x2|\xe2\x8b\xaf|ai,xk|aj,xk=31 holds (where | \xe2\x80\x94 bitwise OR of two numbers). You can perform the following operation any number of times: take any row of the matrix and a number y from 0 to 31 inclusive; then apply the bitwise XOR with the number y to all elements of the selected row. The cost of such an operation is equal to y.Your task is to calculate the minimum cost to make the matrix strange, or report that it is impossible." -999
2011G "Removal of a Permutation" "*special problem" "You are given a permutation p of length n.You can perform operations of two types:   mark all positions i such that 1\xe2\x89\xa4i<n and pi<pi+1, and simultaneously remove the elements at these positions;  mark all positions i such that 2\xe2\x89\xa4i\xe2\x89\xa4n and pi\xe2\x88\x921>pi, and simultaneously remove the elements at these positions. For each integer from 1 to (n\xe2\x88\x921), calculate the minimum number of operations required to remove that integer from the permutation." -999
2011F "Good Subarray" "*special problem,data structures,greedy" "You are given an integer array a of size n.Let\'s call an array good if it can be obtained using the following algorithm: create an array consisting of any single integer; and then perform the following operation an arbitrary number of times: choose an element from the already existing array (let\'s call it x) and add x, (x\xe2\x88\x921), or (x+1) to the end of the array.For example, the arrays [1,2,1], [5] and [3,2,1,4] are good, while [2,4] and [3,1,2] are not.Your task is to count the number of good contiguous subarrays of the array a. Two subarrays that have the same elements but are in different positions of the array a are considered different." -999
2011E "Rock-Paper-Scissors Bot" "*special problem,greedy,strings" "Rock-Paper-Scissors is a game for two players. It is played in rounds. During each round, every player chooses one of three moves: Rock, Paper, or Scissors. Depending on the chosen moves, the following happens:  if one player chooses Rock and the other player chooses Paper, the player who chooses Paper wins and gets a point;  if one player chooses Scissors and the other player chooses Paper, the player who chooses Scissors wins and gets a point;  if one player chooses Scissors and the other player chooses Rock, the player who chooses Rock wins and gets a point;  and if both players choose the same move, nobody wins and nobody gets a point. Monocarp decided to play against a bot. During the game, Monocarp noticed that the bot\'s behavior is very predictable:   in the first round, it chooses Rock;  in every round except the first, it chooses the move that beats the opponent\'s move in the previous round (for example, if in the previous round its opponent played Scissors, then the bot chooses Rock now). Monocarp has a favorite string s, consisting of the characters R, P, and/or S. Monocarp decided to play a series of rounds against the bot. However, he wants both of the following conditions to be met:   the final score is in favor of Monocarp (i.\xe2\x80\x89e., the number of rounds he won is strictly greater than the number of rounds the bot won);  the string s appears as a contiguous substring in the sequence of the bot\'s moves (where R denotes Rock, P denotes Paper, and S denotes Scissors). Help Monocarp and calculate the minimum number of rounds he needs to play against the bot to satisfy both of the aforementioned conditions." -999
2011D "Among Wolves" "*special problem" "In a game you started playing recently, there is a field that can be represented as a rectangular grid. The field has 2 rows and n columns \xe2\x80\x94 2n cells in total.Some cells are empty, but some are occupied by wolves. In the beginning of the game, you have one sheep in some cell, and you\'d like to save it from wolves.Wolves will attack you at night, so you still have some time for preparation. You have two ways to deal with wolves:   You pay h coins to hunters and choose a cell occupied by a wolf. Hunters will clear the cell, eradicating the wolf in it.  You pay b coins to builders and choose an empty cell. Builders will dig a trench in the chosen cell that wolves can\'t cross.  You can use both methods mentioned above any number of times and in any order.Let\'s say that a wolf can reach the sheep if there is a path that starts at the wolf\'s cell and finishes at the sheep\'s cell. This path shouldn\'t contain any cells with trenches, and each two consecutive cells in the path should be neighbors (share a side).What is the minimum total amount of money you should pay to ensure that none of the wolves can reach the sheep?" -999
2011C "Split the Expression" "*special problem" "You are given a string s of the form <block of digits>+<block of digits>+...+<block of digits>. Every block of digits consists of at least 2 and at most 13 digits; every digit is from 1 to 9.You have to split this string into expressions of the form <integer>+<integer>. Every expression must be a contiguous part of the given string, and every character of the given string must belong to exactly one expression. For example, if you have a string 123+456+789+555, then:  you are allowed to split it into 123+4, 56+7 and 89+555;  you are not allowed to split it into 123+456 and +789+555, since the second part begins with a + sign;  you are not allowed to split it into 123+4, 56+7, 8 and 9+555, since the third part does not contain a + sign;  you are not allowed to split it into 123+456+78 and 9+555, since the first part contains two + signs. Among all allowed ways to split the string, find one which maximizes the sum of results of all expressions you get, and print this sum." -999
2011B Shuffle "*special problem" "Yes, this is another one of those constructive permutation problems.You are given an integer n. You have to construct a permutation p of size n, i.\xe2\x80\x89e. an array of n integers, where every integer from 1 to n appears exactly once.Every pair of adjacent elements in the permutation (pi and pi+1) must meet the following condition:  if one of them is divisible by the other, the condition pi<pi+1 must hold;  otherwise, the condition pi>pi+1 must hold." -999
2011A "Problem Solving" "*special problem" "Jane has decided to solve a list of n problems on Codeforces. The i-th problem in her list has difficulty di, and the last problem in the list is the hardest one (for every problem j<n, dj<dn).Jane\'s problem-solving skill is some integer x (unknown to you). If a problem\'s difficulty is greater than x, then Jane cannot solve it, otherwise she can solve it.Jane has solved all problems form the list, except for the last one \xe2\x80\x94 she found out that it was too difficult for her. Can you uniquely determine the value of x \xe2\x80\x94 Jane\'s problem solving skill?" -999
2010C2 "Message Transmission Error (hard version)" "hashing,string suffix structures,strings,two pointers" "This is a more difficult version of the problem. It differs from the easy one only by the constraints.At the Berland State University, the local network between servers does not always operate without errors. When transmitting two identical messages consecutively, an error may occur, resulting in the two messages merging into one. In this merging, the end of the first message coincides with the beginning of the second. Of course, the merging can only occur at identical characters. The length of the merging must be a positive number less than the length of the message text.For example, when transmitting two messages ""abrakadabra"" consecutively, it is possible that it will be transmitted with the described type of error, resulting in a message like ""abrakadabrabrakadabra"" or ""abrakadabrakadabra\' (in the first case, the merging occurred at one character, and in the second case, at four).Given the received message t, determine if it is possible that this is the result of an error of the described type in the operation of the local network, and if so, determine a possible value of s.A situation where two messages completely overlap each other should not be considered an error. For example, if the received message is ""abcd"", it should be considered that there is no error in it. Similarly, simply appending one message after another is not a sign of an error. For instance, if the received message is ""abcabc"", it should also be considered that there is no error in it." 1700
2010C1 "Message Transmission Error (easy version)" "brute force,strings" "This is a simplified version of the problem. It differs from the difficult one only in its constraints.At the Berland State University, the local network between servers does not always operate without errors. When transmitting two identical messages consecutively, an error may occur, resulting in the two messages merging into one. In this merging, the end of the first message coincides with the beginning of the second. Of course, the merging can only occur at identical characters. The length of the merging must be a positive number less than the length of the message text.For example, when transmitting two messages ""abrakadabra"" consecutively, it is possible that it will be transmitted with the described type of error, resulting in a message like ""abrakadabrabrakadabra"" or ""abrakadabrakadabra\' (in the first case, the merging occurred at one character, and in the second case, at four).Given the received message t, determine if it is possible that this is the result of an error of the described type in the operation of the local network, and if so, determine a possible value of s.A situation where two messages completely overlap each other should not be considered an error. For example, if the received message is ""abcd"", it should be considered that there is no error in it. Similarly, simply appending one message after another is not a sign of an error. For instance, if the received message is ""abcabc"", it should also be considered that there is no error in it." 1400
2010B "Three Brothers" "brute force,implementation,math" "Three brothers agreed to meet. Let\'s number the brothers as follows: the oldest brother is number 1, the middle brother is number 2, and the youngest brother is number 3.When it was time for the meeting, one of the brothers was late. Given the numbers of the two brothers who arrived on time, you need to determine the number of the brother who was late." 800
2010A "Alternating Sum of Numbers" "brute force,implementation,math" "You are given a sequence of integers. Output the alternating sum of this sequence. In other words, output a1\xe2\x88\x92a2+a3\xe2\x88\x92a4+a5\xe2\x88\x92\xe2\x80\xa6. That is, the signs of plus and minus alternate, starting with a plus." 800
2009G3 "Yunli\'s Subarray Queries (extreme version)" "data structures,dp,implementation" "This is the extreme version of the problem. In this version, the output of each query is different from the easy and hard versions. It is also guaranteed that r\xe2\x89\xa5l+k\xe2\x88\x921 for all queries.For an arbitrary array b, Yunli can perform the following operation any number of times:  Select an index i. Set bi=x where x is any integer she desires (x is not limited to the interval [1,n]). Denote f(b) as the minimum number of operations she needs to perform until there exists a consecutive subarray\xe2\x88\x97 of length at least k in b.Yunli is given an array a of size n and asks you q queries. In each query, you must output \xe2\x88\x91r\xe2\x88\x92k+1i=l\xe2\x88\x91rj=i+k\xe2\x88\x921f([ai,ai+1,\xe2\x80\xa6,aj]).\xe2\x88\x97If there exists a consecutive subarray of length k that starts at index i (1\xe2\x89\xa4i\xe2\x89\xa4|b|\xe2\x88\x92k+1), then bj=bj\xe2\x88\x921+1 for all i<j\xe2\x89\xa4i+k\xe2\x88\x921." 2700
2009G2 "Yunli\'s Subarray Queries (hard version)" "binary search,data structures,dp" "This is the hard version of the problem. In this version, it is guaranteed that r\xe2\x89\xa5l+k\xe2\x88\x921 for all queries.For an arbitrary array b, Yunli can perform the following operation any number of times:  Select an index i. Set bi=x where x is any integer she desires (x is not limited to the interval [1,n]). Denote f(b) as the minimum number of operations she needs to perform until there exists a consecutive subarray\xe2\x88\x97 of length at least k in b.Yunli is given an array a of size n and asks you q queries. In each query, you must output \xe2\x88\x91rj=l+k\xe2\x88\x921f([al,al+1,\xe2\x80\xa6,aj]).\xe2\x88\x97If there exists a consecutive subarray of length k that starts at index i (1\xe2\x89\xa4i\xe2\x89\xa4|b|\xe2\x88\x92k+1), then bj=bj\xe2\x88\x921+1 for all i<j\xe2\x89\xa4i+k\xe2\x88\x921." 2200
2009G1 "Yunli\'s Subarray Queries (easy version)" "binary search,data structures,two pointers" "This is the easy version of the problem. In this version, it is guaranteed that r=l+k\xe2\x88\x921 for all queries.For an arbitrary array b, Yunli can perform the following operation any number of times:  Select an index i. Set bi=x where x is any integer she desires (x is not limited to the interval [1,n]). Denote f(b) as the minimum number of operations she needs to perform until there exists a consecutive subarray\xe2\x88\x97 of length at least k in b.Yunli is given an array a of size n and asks you q queries. In each query, you must output \xe2\x88\x91rj=l+k\xe2\x88\x921f([al,al+1,\xe2\x80\xa6,aj]). Note that in this version, you are only required to output f([al,al+1,\xe2\x80\xa6,al+k\xe2\x88\x921]).\xe2\x88\x97If there exists a consecutive subarray of length k that starts at index i (1\xe2\x89\xa4i\xe2\x89\xa4|b|\xe2\x88\x92k+1), then bj=bj\xe2\x88\x921+1 for all i<j\xe2\x89\xa4i+k\xe2\x88\x921." 1900
