1714G "Path Prefixes" "binary search,data structures,dfs and similar,trees" "You are given a rooted tree. It contains n vertices, which are numbered from 1 to n. The root is the vertex 1.Each edge has two positive integer values. Thus, two positive integers aj and bj are given for each edge.Output n\xe2\x88\x921 numbers r2,r3,\xe2\x80\xa6,rn, where ri is defined as follows.Consider the path from the root (vertex 1) to i (2\xe2\x89\xa4i\xe2\x89\xa4n). Let the sum of the costs of aj along this path be Ai. Then ri is equal to the length of the maximum prefix of this path such that the sum of bj along this prefix does not exceed Ai.  Example for n=9. The blue color shows the costs of aj, and the red color shows the costs of bj. Consider an example. In this case:  r2=0, since the path to 2 has an amount of aj equal to 5, only the prefix of this path of length 0 has a smaller or equal amount of bj; r3=3, since the path to 3 has an amount of aj equal to 5+9+5=19, the prefix of length 3 of this path has a sum of bj equal to 6+10+1=17 ( the number is 17\xe2\x89\xa419); r4=1, since the path to 4 has an amount of aj equal to 5+9=14, the prefix of length 1 of this path has an amount of bj equal to 6 (this is the longest suitable prefix, since the prefix of length 2 already has an amount of bj equal to 6+10=16, which is more than 14); r5=2, since the path to 5 has an amount of aj equal to 5+9+2=16, the prefix of length 2 of this path has a sum of bj equal to 6+10=16 (this is the longest suitable prefix, since the prefix of length 3 already has an amount of bj equal to 6+10+1=17, what is more than 16); r6=1, since the path up to 6 has an amount of aj equal to 2, the prefix of length 1 of this path has an amount of bj equal to 1; r7=1, since the path to 7 has an amount of aj equal to 5+3=8, the prefix of length 1 of this path has an amount of bj equal to 6 (this is the longest suitable prefix, since the prefix of length 2 already has an amount of bj equal to 6+3=9, which is more than 8); r8=2, since the path up to 8 has an amount of aj equal to 2+4=6, the prefix of length 2 of this path has an amount of bj equal to 1+3=4; r9=3, since the path to 9 has an amount of aj equal to 2+4+1=7, the prefix of length 3 of this path has a sum of bj equal to 1+3+3=7." 1700
1714F "Build a Tree and That Is It" "constructive algorithms,implementation,trees" "A tree is a connected undirected graph without cycles. Note that in this problem, we are talking about not rooted trees.You are given four positive integers n,d12,d23 and d31. Construct a tree such that:  it contains n vertices numbered from 1 to n,  the distance (length of the shortest path) from vertex 1 to vertex 2 is d12,  distance from vertex 2 to vertex 3 is d23,  the distance from vertex 3 to vertex 1 is d31. Output any tree that satisfies all the requirements above, or determine that no such tree exists." 1900
1714E "Add Modulo 10" "brute force,math,number theory" "You are given an array of n integers a1,a2,\xe2\x80\xa6,anYou can apply the following operation an arbitrary number of times:   select an index i (1\xe2\x89\xa4i\xe2\x89\xa4n) and replace the value of the element ai with the value ai+(aimod10), where aimod10 is the remainder of the integer dividing ai by 10. For a single index (value i), this operation can be applied multiple times. If the operation is applied repeatedly to the same index, then the current value of ai is taken into account each time. For example, if ai=47 then after the first operation we get ai=47+7=54, and after the second operation we get ai=54+4=58.Check if it is possible to make all array elements equal by applying multiple (possibly zero) operations.For example, you have an array [6,11].   Let\'s apply this operation to the first element of the array. Let\'s replace a1=6 with a1+(a1mod10)=6+(6mod10)=6+6=12. We get the array [12,11].  Then apply this operation to the second element of the array. Let\'s replace a2=11 with a2+(a2mod10)=11+(11mod10)=11+1=12. We get the array [12,12]. Thus, by applying 2 operations, you can make all elements of an array equal." 1400
1714D "Color with Occurrences" "brute force,data structures,dp,greedy,strings" "You are given some text t and a set of n strings s1,s2,\xe2\x80\xa6,sn. In one step, you can choose any occurrence of any string si in the text t and color the corresponding characters of the text in red. For example, if t=bababa and s1=ba, s2=aba, you can get t=bababa, t=bababa or t=bababa in one step.You want to color all the letters of the text t in red. When you color a letter in red again, it stays red.In the example above, three steps are enough:  Let\'s color t[2\xe2\x80\xa64]=s2=aba in red, we get t=bababa;  Let\'s color t[1\xe2\x80\xa62]=s1=ba in red, we get t=bababa;  Let\'s color t[4\xe2\x80\xa66]=s2=aba in red, we get t=bababa. Each string si can be applied any number of times (or not at all). Occurrences for coloring can intersect arbitrarily.Determine the minimum number of steps needed to color all letters t in red and how to do it. If it is impossible to color all letters of the text t in red, output -1." 1600
1714C "Minimum  Varied Number" greedy "Find the minimum number with the given sum of digits s such that all digits in it are distinct (i.e. all digits are unique).For example, if s=20, then the answer is 389. This is the minimum number in which all digits are different and the sum of the digits is 20 (3+8+9=20).For the given s print the required number." 800
1714B "Remove Prefix" "data structures,greedy,implementation" "Polycarp was presented with some sequence of integers a of length n (1\xe2\x89\xa4ai\xe2\x89\xa4n). A sequence can make Polycarp happy only if it consists of different numbers (i.e. distinct numbers).In order to make his sequence like this, Polycarp is going to make some (possibly zero) number of moves.In one move, he can:   remove the first (leftmost) element of the sequence. For example, in one move, the sequence [3,1,4,3] will produce the sequence [1,4,3], which consists of different numbers.Determine the minimum number of moves he needs to make so that in the remaining sequence all elements are different. In other words, find the length of the smallest prefix of the given sequence a, after removing which all values in the sequence will be unique." 800
1714A "Everyone Loves to Sleep" implementation,math "Vlad, like everyone else, loves to sleep very much.Every day Vlad has to do n things, each at a certain time. For each of these things, he has an alarm clock set, the i-th of them is triggered on hi hours mi minutes every day (0\xe2\x89\xa4hi<24,0\xe2\x89\xa4mi<60). Vlad uses the 24-hour time format, so after h=12,m=59 comes h=13,m=0 and after h=23,m=59 comes h=0,m=0.This time Vlad went to bed at H hours M minutes (0\xe2\x89\xa4H<24,0\xe2\x89\xa4M<60) and asks you to answer: how much he will be able to sleep until the next alarm clock.If any alarm clock rings at the time when he went to bed, then he will sleep for a period of time of length 0." 900
1713F "Lost Array" "bitmasks,combinatorics,constructive algorithms,dp,math" "My orzlers, we can optimize this problem from O(S3) to O(T59)!\xe2\x80\x94 Spyofgame, founder of Orzlim religionA long time ago, Spyofgame invented the famous array a (1-indexed) of length n that contains information about the world and life. After that, he decided to convert it into the matrix b (0-indexed) of size (n+1)\xc3\x97(n+1) which contains information about the world, life and beyond.Spyofgame converted a into b with the following rules.  bi,0=0 if 0\xe2\x89\xa4i\xe2\x89\xa4n;  b0,i=ai if 1\xe2\x89\xa4i\xe2\x89\xa4n;  bi,j=bi,j\xe2\x88\x921\xe2\x8a\x95bi\xe2\x88\x921,j if 1\xe2\x89\xa4i,j\xe2\x89\xa4n. Here \xe2\x8a\x95 denotes the bitwise XOR operation.Today, archaeologists have discovered the famous matrix b. However, many elements of the matrix has been lost. They only know the values of bi,n for 1\xe2\x89\xa4i\xe2\x89\xa4n (note that these are some elements of the last column, not the last row).The archaeologists want to know what a possible array of a is. Can you help them reconstruct any array that could be a?" 2900
1713E "Cross Swapping" "2-sat,data structures,dsu,greedy,matrices" "You are given a square matrix A of size n\xc3\x97n whose elements are integers. We will denote the element on the intersection of the i-th row and the j-th column as Ai,j.You can perform operations on the matrix. In each operation, you can choose an integer k, then for each index i (1\xe2\x89\xa4i\xe2\x89\xa4n), swap Ai,k with Ak,i. Note that cell Ak,k remains unchanged.For example, for n=4 and k=3, this matrix will be transformed like this:  The operation k=3 swaps the blue row with the green column. You can perform this operation any number of times. Find the lexicographically smallest matrix\xe2\x80\xa0 you can obtain after performing arbitrary number of operations.\xe2\x80\xa0 For two matrices A and B of size n\xc3\x97n, let a(i\xe2\x88\x921)\xe2\x8b\x85n+j=Ai,j and b(i\xe2\x88\x921)\xe2\x8b\x85n+j=Bi,j. Then, the matrix A is lexicographically smaller than the matrix B when there exists an index i (1\xe2\x89\xa4i\xe2\x89\xa4n2) such that ai<bi and for all indices j such that 1\xe2\x89\xa4j<i, aj=bj." 2400
1713D "Tournament Countdown" "constructive algorithms,greedy,interactive,number theory,probabilities" "This is an interactive problem.There was a tournament consisting of 2n contestants. The 1-st contestant competed with the 2-nd, the 3-rd competed with the 4-th, and so on. After that, the winner of the first match competed with the winner of second match, etc. The tournament ended when there was only one contestant left, who was declared the winner of the tournament. Such a tournament scheme is known as the single-elimination tournament.You don\'t know the results, but you want to find the winner of the tournament. In one query, you select two integers a and b, which are the indices of two contestants. The jury will return 1 if a won more matches than b, 2 if b won more matches than a, or 0 if their number of wins was equal.Find the winner in no more than \xe2\x8c\x8813\xe2\x8b\x852n+1\xe2\x8c\x89 queries. Here \xe2\x8c\x88x\xe2\x8c\x89 denotes the value of x rounded up to the nearest integer.Note that the tournament is long over, meaning that the results are fixed and do not depend on your queries." 1800
1713C "Build Permutation" "constructive algorithms,dp,math" "A 0-indexed array a of size n is called good if for all valid indices i (0\xe2\x89\xa4i\xe2\x89\xa4n\xe2\x88\x921), ai+i is a perfect square\xe2\x80\xa0.Given an integer n. Find a permutation\xe2\x80\xa1 p of [0,1,2,\xe2\x80\xa6,n\xe2\x88\x921] that is good or determine that no such permutation exists.\xe2\x80\xa0 An integer x is said to be a perfect square if there exists an integer y such that x=y2.\xe2\x80\xa1 An array b is a permutation of an array a if b consists of the elements of a in arbitrary order. For example, [4,2,3,4] is a permutation of [3,2,4,4] while [1,2,2] is not a permutation of [1,2,3]." 1200
1713B "Optimal Reduction" "constructive algorithms,sortings" "Consider an array a of n positive integers.You may perform the following operation:   select two indices l and r (1\xe2\x89\xa4l\xe2\x89\xa4r\xe2\x89\xa4n), then  decrease all elements al,al+1,\xe2\x80\xa6,ar by 1. Let\'s call f(a) the minimum number of operations needed to change array a into an array of n zeros.Determine if for all permutations\xe2\x80\xa0 b of a, f(a)\xe2\x89\xa4f(b) is true. \xe2\x80\xa0 An array b is a permutation of an array a if b consists of the elements of a in arbitrary order. For example, [4,2,3,4] is a permutation of [3,2,4,4] while [1,2,2] is not a permutation of [1,2,3]." 1000
1713A "Traveling Salesman Problem" geometry,greedy,implementation "You are living on an infinite plane with the Cartesian coordinate system on it. In one move you can go to any of the four adjacent points (left, right, up, down).More formally, if you are standing at the point (x,y), you can:   go left, and move to (x\xe2\x88\x921,y), or  go right, and move to (x+1,y), or  go up, and move to (x,y+1), or  go down, and move to (x,y\xe2\x88\x921). There are n boxes on this plane. The i-th box has coordinates (xi,yi). It is guaranteed that the boxes are either on the x-axis or the y-axis. That is, either xi=0 or yi=0.You can collect a box if you and the box are at the same point. Find the minimum number of moves you have to perform to collect all of these boxes if you have to start and finish at the point (0,0)." 800
1712F Triameter "binary search,data structures,dfs and similar,trees" "\xe2\x80\x94 What is my mission?  \xe2\x80\x94 To count graph diameters.You and Your SubmissionA tree is a connected undirected graph without cycles. A weighted tree has a weight assigned to each edge. The degree of a vertex is the number of edges connected to this vertex.You are given a weighted tree with n vertices, each edge has a weight of 1. Let L be the set of vertices with degree equal to 1. You have to answer q independent queries. In the i-th query:  You are given a positive integer xi.  For all u,v\xe2\x88\x88L such that u<v, add edge (u,v) with weight xi to the graph (initially the given tree).  Find the diameter of the resulting graph. The diameter of a graph is equal to max1\xe2\x89\xa4u<v\xe2\x89\xa4nd(u,v), where d(u,v) is the length of the shortest path between vertex u and vertex v." 3200
1712E2 "LCM Sum (hard version)" "brute force,data structures,math,number theory,two pointers" "We are sum for we are manySome NumberThis version of the problem differs from the previous one only in the constraint on t. You can make hacks only if both versions of the problem are solved.You are given two positive integers l and r.Count the number of distinct triplets of integers (i,j,k) such that l\xe2\x89\xa4i<j<k\xe2\x89\xa4r and lcm(i,j,k)\xe2\x89\xa5i+j+k.Here lcm(i,j,k) denotes the least common multiple (LCM) of integers i, j, and k." 2500
1712E1 "LCM Sum (easy version)" "binary search,brute force,combinatorics,math,number theory,two pointers" "We are sum for we are manySome NumberThis version of the problem differs from the next one only in the constraint on t. You can make hacks only if both versions of the problem are solved.You are given two positive integers l and r.Count the number of distinct triplets of integers (i,j,k) such that l\xe2\x89\xa4i<j<k\xe2\x89\xa4r and lcm(i,j,k)\xe2\x89\xa5i+j+k.Here lcm(i,j,k) denotes the least common multiple (LCM) of integers i, j, and k." 2300
1712D "Empty Graph" "binary search,constructive algorithms,data structures,greedy,shortest paths" "\xe2\x80\x94 Do you have a wish?  \xe2\x80\x94 I want people to stop gifting each other arrays.O_o and Another Young BoyAn array of n positive integers a1,a2,\xe2\x80\xa6,an fell down on you from the skies, along with a positive integer k\xe2\x89\xa4n.You can apply the following operation at most k times:   Choose an index 1\xe2\x89\xa4i\xe2\x89\xa4n and an integer 1\xe2\x89\xa4x\xe2\x89\xa4109. Then do ai:=x (assign x to ai). Then build a complete undirected weighted graph with n vertices numbered with integers from 1 to n, where edge (l,r) (1\xe2\x89\xa4l<r\xe2\x89\xa4n) has weight min(al,al+1,\xe2\x80\xa6,ar).You have to find the maximum possible diameter of the resulting graph after performing at most k operations.The diameter of a graph is equal to max1\xe2\x89\xa4u<v\xe2\x89\xa4nd(u,v), where d(u,v) is the length of the shortest path between vertex u and vertex v." 2000
1712C "Sort Zero" greedy,sortings "An array is sorted if it has no inversionsA Young BoyYou are given an array of n positive integers a1,a2,\xe2\x80\xa6,an. In one operation you do the following:   Choose any integer x.  For all i such that ai=x, do ai:=0 (assign 0 to ai). Find the minimum number of operations required to sort the array in non-decreasing order." 1100
1712B "Woeful Permutation" "constructive algorithms,greedy,number theory" "I wonder, does the falling rain Forever yearn for it\'s disdain?Effluvium of the MindYou are given a positive integer n.Find any permutation p of length n such that the sum lcm(1,p1)+lcm(2,p2)+\xe2\x80\xa6+lcm(n,pn) is as large as possible. Here lcm(x,y) denotes the least common multiple (LCM) of integers x and y.A permutation is an array consisting of n distinct integers from 1 to n in arbitrary order. For example, [2,3,1,5,4] is a permutation, but [1,2,2] is not a permutation (2 appears twice in the array) and [1,3,4] is also not a permutation (n=3 but there is 4 in the array)." 800
1712A "Wonderful Permutation" greedy,implementation "God\'s Blessing on This PermutationForces!A Random PebbleYou are given a permutation p1,p2,\xe2\x80\xa6,pn of length n and a positive integer k\xe2\x89\xa4n. In one operation you can choose two indices i and j (1\xe2\x89\xa4i<j\xe2\x89\xa4n) and swap pi with pj.Find the minimum number of operations needed to make the sum p1+p2+\xe2\x80\xa6+pk as small as possible.A permutation is an array consisting of n distinct integers from 1 to n in arbitrary order. For example, [2,3,1,5,4] is a permutation, but [1,2,2] is not a permutation (2 appears twice in the array) and [1,3,4] is also not a permutation (n=3 but there is 4 in the array)." 800
1711B Party "brute force,graphs" "A club plans to hold a party and will invite some of its n members. The n members are identified by the numbers 1,2,\xe2\x80\xa6,n. If member i is not invited, the party will gain an unhappiness value of ai.There are m pairs of friends among the n members. As per tradition, if both people from a friend pair are invited, they will share a cake at the party. The total number of cakes eaten will be equal to the number of pairs of friends such that both members have been invited.However, the club\'s oven can only cook two cakes at a time. So, the club demands that the total number of cakes eaten is an even number.What is the minimum possible total unhappiness value of the party, respecting the constraint that the total number of cakes eaten is even?" 1300
1711A "Perfect Permutation" "constructive algorithms" "You are given a positive integer n.The weight of a permutation p1,p2,\xe2\x80\xa6,pn is the number of indices 1\xe2\x89\xa4i\xe2\x89\xa4n such that i divides pi. Find a permutation p1,p2,\xe2\x80\xa6,pn with the minimum possible weight (among all permutations of length n).A permutation is an array consisting of n distinct integers from 1 to n in arbitrary order. For example, [2,3,1,5,4] is a permutation, but [1,2,2] is not a permutation (2 appears twice in the array) and [1,3,4] is also not a permutation (n=3 but there is 4 in the array)." 800
1710E "Two Arrays" "binary search,games,graph matchings" "You are given two arrays of integers a1,a2,\xe2\x80\xa6,an and b1,b2,\xe2\x80\xa6,bm. Alice and Bob are going to play a game. Alice moves first and they take turns making a move.They play on a grid of size n\xc3\x97m (a grid with n rows and m columns). Initially, there is a rook positioned on the first row and first column of the grid.During her/his move, a player can do one of the following two operations:  Move the rook to a different cell on the same row or the same column of the current cell. A player cannot move the rook to a cell that has been visited 1000 times before (i.e., the rook can stay in a certain cell at most 1000 times during the entire game). Note that the starting cell is considered to be visited once at the beginning of the game. End the game immediately with a score of ar+bc, where (r,c) is the current cell (i.e., the rook is on the r-th row and c-th column). Bob wants to maximize the score while Alice wants to minimize it. If they both play this game optimally, what is the final score of the game?" 2400
1710D "Recover the Tree" "constructive algorithms,trees" "Rhodoks has a tree with n vertices, but he doesn\'t remember its structure. The vertices are indexed from 1 to n.A segment [l,r] (1\xe2\x89\xa4l\xe2\x89\xa4r\xe2\x89\xa4n) is good if the vertices with indices l, l+1, ..., r form a connected component in Rhodoks\' tree. Otherwise, it is bad.For example, if the tree is the one in the picture, then only the segment [3,4] is bad while all the other segments are good.  For each of the n(n+1)2 segments, Rhodoks remembers whether it is good or bad. Can you help him recover the tree? If there are multiple solutions, print any.It is guaranteed that the there is at least one tree satisfying Rhodoks\' description." 3400
1710C "XOR Triangle" "bitmasks,brute force,constructive algorithms,dp,greedy,math" "You are given a positive integer n. Since n may be very large, you are given its binary representation.You should compute the number of triples (a,b,c) with 0\xe2\x89\xa4a,b,c\xe2\x89\xa4n such that a\xe2\x8a\x95b, b\xe2\x8a\x95c, and a\xe2\x8a\x95c are the sides of a non-degenerate triangle. Here, \xe2\x8a\x95 denotes the bitwise XOR operation.You should output the answer modulo 998244353.Three positive values x, y, and z are the sides of a non-degenerate triangle if and only if x+y>z, x+z>y, and y+z>x." 2500
1710B Rain "binary search,brute force,data structures,geometry,greedy,implementation,math" "You are the owner of a harvesting field which can be modeled as an infinite line, whose positions are identified by integers.It will rain for the next n days. On the i-th day, the rain will be centered at position xi and it will have intensity pi. Due to these rains, some rainfall will accumulate; let aj be the amount of rainfall accumulated at integer position j. Initially aj is 0, and it will increase by max(0,pi\xe2\x88\x92|xi\xe2\x88\x92j|) after the i-th day\'s rain.A flood will hit your field if, at any moment, there is a position j with accumulated rainfall aj>m.You can use a magical spell to erase exactly one day\'s rain, i.e., setting pi=0. For each i from 1 to n, check whether in case of erasing the i-th day\'s rain there is no flood." 2100
1710A "Color the Picture" "constructive algorithms,greedy,math" "A picture can be represented as an n\xc3\x97m grid (n rows and m columns) so that each of the n\xe2\x8b\x85m cells is colored with one color. You have k pigments of different colors. You have a limited amount of each pigment, more precisely you can color at most ai cells with the i-th pigment.A picture is considered beautiful if each cell has at least 3 toroidal neighbors with the same color as itself.Two cells are considered toroidal neighbors if they toroidally share an edge. In other words, for some integers 1\xe2\x89\xa4x1,x2\xe2\x89\xa4n and 1\xe2\x89\xa4y1,y2\xe2\x89\xa4m, the cell in the x1-th row and y1-th column is a toroidal neighbor of the cell in the x2-th row and y2-th column if one of following two conditions holds:  x1\xe2\x88\x92x2\xe2\x89\xa1\xc2\xb11(modn) and y1=y2, or  y1\xe2\x88\x92y2\xe2\x89\xa1\xc2\xb11(modm) and x1=x2. Notice that each cell has exactly 4 toroidal neighbors. For example, if n=3 and m=4, the toroidal neighbors of the cell (1,2) (the cell on the first row and second column) are: (3,2), (2,2), (1,3), (1,1). They are shown in gray on the image below:  The gray cells show toroidal neighbors of (1,2). Is it possible to color all cells with the pigments provided and create a beautiful picture?" 1500
1709F "Multiset of Strings" "bitmasks,brute force,dp,fft,flows,graphs,math,meet-in-the-middle,trees" "You are given three integers n, k and f.Consider all binary strings (i.\xe2\x80\x89e. all strings consisting of characters 0 and/or 1) of length from 1 to n. For every such string s, you need to choose an integer cs from 0 to k.A multiset of binary strings of length exactly n is considered beautiful if for every binary string s with length from 1 to n, the number of strings in the multiset such that s is their prefix is not exceeding cs.For example, let n=2, c0=3, c00=1, c01=2, c1=1, c10=2, and c11=3. The multiset of strings {11,01,00,01} is beautiful, since:  for the string 0, there are 3 strings in the multiset such that 0 is their prefix, and 3\xe2\x89\xa4c0;  for the string 00, there is one string in the multiset such that 00 is its prefix, and 1\xe2\x89\xa4c00;  for the string 01, there are 2 strings in the multiset such that 01 is their prefix, and 2\xe2\x89\xa4c01;  for the string 1, there is one string in the multiset such that 1 is its prefix, and 1\xe2\x89\xa4c1;  for the string 10, there are 0 strings in the multiset such that 10 is their prefix, and 0\xe2\x89\xa4c10;  for the string 11, there is one string in the multiset such that 11 is its prefix, and 1\xe2\x89\xa4c11. Now, for the problem itself. You have to calculate the number of ways to choose the integer cs for every binary string s of length from 1 to n in such a way that the maximum possible size of a beautiful multiset is exactly f." 2500
1709E "XOR Tree" "bitmasks,data structures,dfs and similar,dsu,greedy,trees" "You are given a tree consisting of n vertices. A number is written on each vertex; the number on vertex i is equal to ai.Recall that a simple path is a path that visits each vertex at most once. Let the weight of the path be the bitwise XOR of the values written on vertices it consists of. Let\'s say that a tree is good if no simple path has weight 0.You can apply the following operation any number of times (possibly, zero): select a vertex of the tree and replace the value written on it with an arbitrary positive integer. What is the minimum number of times you have to apply this operation in order to make the tree good?" 2400
